time,user,rating,comment,votes
2019-08-09 10:48:57,请尊敬王道长,1,忽悠人看这部电影浪费时间，四舍五入约等于杀人。。。,84
2019-08-10 01:11:36,豆瓣兄弟,1,截止到此时此刻，豆瓣打分人数是5.8万人，其中7.2%给了4~5星，约4200人。而鹿晗有6000多万粉丝，随便出来几十万粉丝就可以把分数顶到至少6分以上。然而就目前这情况，只有两种可能性：1，鹿晗真实粉丝只有1~2万人；2，鹿晗的确有6000多万粉丝，但鹿晗99%的粉丝也觉得是一部烂片，干脆不打分甚至也给了差评。————这种电影没必要做影评，全程和女朋友一块玩荣耀，时不时亲热一下……这部电影的票钱花的很亏，不如去喝星巴克，还耽误时间。,63
2019-08-10 10:47:32,二春,1,什么都不说了，头发都舍不得剪，有军人不是板寸的吗？看看隔壁韩国小鲜肉们为了电影怎样塑造角色的。咱们还是资源太多，各种来路不明的钱大量进入影视行业，让所谓明星们拿到虚高的片酬，根本或者就不想有所长进。反正买不买座是公司的事，捞一把就跑成了常态，如此畸形的市场，希望有一天能回归理性。,121
2019-08-09 13:00:48,杨威利,1,衷心祝愿这是流量时代最后的挣扎,129
2019-08-12 16:00:01,陈如阳没有微博,5,空调温度很好 沙发坐着也很舒服，奶茶味道不错。嗯 这种片子应该多出一点，毕竟当代青年的睡眠效果不大好，有了这个睡起来舒服多了！必须五星！,44
2019-08-09 10:46:31,!,1,遗憾，这次《上海堡垒》是真的失败首先特效不过关，跟国产科幻片标杆《流浪地球》比差的很远，剧组之前宣传制作周期长，但现在看特效根本不过关，这对爆米花式科幻片来说是硬伤其次，剧情不合理，生硬粗糙，美式英雄主义拯救地球的老套路，却没有一个深刻的内核，影片显得单薄无力最后是演员问题，男主鹿晗作为流量出生“演员”，演技浮夸流于表面，基本看不出人物内心感情变化，市场化包装的小鲜肉在大银幕下原形毕露，这样的人拿着天价片酬占领银幕，不得不说是中国电影的悲哀,169
2019-08-16 10:23:37,Ting.E=mc²,1,《上海堡垒》有一个点，是其他烂片没有做到的：把几个目标观众群体分别最反感的元素，放到了一部电影里。比如说：让军事迷看鹿晗做战斗英雄；让硬科幻迷看漏洞百出的科幻设定；让鹿晗迷看鹿晗跟舒淇阿姨谈恋爱；让原著迷看亲妈都不认识的魔改；,69
2019-09-02 18:09:04,芦哲峰,1,集中全部能量打了两炮，母舰受惊而退，阵痛而亡。,29
2019-08-09 20:53:41,风蚀蘑菇,2,"特效不错，故事是真的不太行。倒也不是烂，就是非常平庸无聊。打外星人就是，大罩子出现漏洞了，舒淇鹿晗一群人就坐在电脑前噼里啪啦按键盘修补漏洞。然后看上海被外星人炸来炸去，地面人员拿着小枪枪打来打去，然而不管是地面人员还是空军都没什么卵用，最后还得靠大炮。剧情就是他们一次又一次 射啊！射啊！射啊！射了三次，上海沦陷，队友全灭，鹿晗活了，人类赢了。归根结底核心点子太老套无趣了，隔壁人家点燃木星带着地球跑，你在这边用意大利炮射外星人，宛若重回1970。还非常的世界系，全片除了主角这几个人在打怪兽外，好像就没有别的活人了，那种""棚内搭景感""非常重。而且整个片的拍法太主旋律了，感觉像看科幻版焦裕禄。一个人去看片，又不好玩手机，听着隔壁两个女的不时发出一阵阵爆笑，无聊到想加入她们一起纵享欢乐：）",43
2019-08-09 12:43:41,.L.,1,请公开鹿晗片酬,55
2019-08-09 19:05:35,一只孤独的船,1,我感觉外星人就是来消灭鹿晗的，这次我站外星人那边,120
2019-08-09 13:01:15,懵,5,1.上海堡垒电影特效实在太炫酷，从它出来那一刻就知道经费在燃烧啊，整部电影的几场对战动作戏非常不错，特效满分！两千多人花了六年时间打磨出来的作品，实属不易！对于电影《上海堡垒》真的喜欢，中国科幻需要勇气，愿中国的科幻越来越好！2.演员们的表现可圈可点，结尾那里鹿晗的台词戏非常震撼，角色代入感很好，鹿晗的眼睛会说话，京腔也很好听。3.最后要说！一定要看彩蛋！一定要看彩蛋！一定要看彩蛋！电影院此起彼伏的哭声啊！！！！！！,152
2022-02-01 10:08:44,吸管,1,大年初一和家长在中央6台看到这东西，真晦气……,44
2019-08-09 11:57:22,苏黎世的列车,1,鹿晗：林澜，我喜欢你，用尽了最后五分钟的力气。舒淇：好好睡，晚安,74
2019-08-09 13:39:57,wchushen,1,大ip+流量明星的模式已经骗不到钱了。,126
2019-08-11 21:37:21,喻鸣,2,不抱啥期望也未达到超出期待的效果，一部火力十足的科幻片竟然连连犯困。主要问题还是太悬浮，靠仙藤能量维持运转的世界到底是怎样的？连与科幻背景匹配的武力和防御体系都没有，更谈不上科幻世界观。爱情是悬浮的，小分队情感也是悬浮的，无法打动人就是原罪，太对不起那六年和3.6亿了。上海都沉了，鹿晗的刘海都还不乱，还要啥大炮要啥泡防御，用发丝筑起新的长城好啦。,17
2019-08-04 18:38:31,时光Serene,3,刚开始看电影的时候，看到影片定义为爱情，战争，科幻，看完之后感觉更多的是剧情片，灾难片。最后处理的部分，刚开始会觉得有一些小格局，但是细想一番，爱情和对事业的坚守一样都会“念念不忘，必有回响”。我们最坚实的堡垒是我们破釜沉舟的勇气。陆沉怎样，堡垒失守又怎样，我们的心气不灭，我们就一定守住一方阵地，最终实现绝地反击，夺取最后胜利。,419
2019-08-10 00:00:52,晚不安,1,眼见他起朱楼，眼见他宴宾客，眼见他楼塌了。超低配版《独立日》，名副其实的“灾难”片。看完第一反应是：太浪费了！砸这么多钱包装一个土得掉渣的言情故事——用小灵通发晚安短信明明是初中的戏码呀！美学体系、情节逻辑、人物表演全面不及格。如果卖几个站不住脚的设定，用特效做点拿来主义的武器、建筑，这样就能扛起科幻大旗的话，那中国科幻早就不是第二步，已经开始奔小康了。更何况动作场面也丝毫没有新颖之处，打斗戏的分镜可比《流浪地球》凌乱多了。各路好评还要硬cue你球，分这么低都是同行衬托的呀……,52
2019-08-09 15:00:25,薛天华,1,流浪地球改变了中国科幻电影，上海堡垒又改了回来！吴京让我看到了中国演员的希望，鹿晗又让我看到了失望！郭帆让我看到了导演转型的成功，滕华涛又让我看到了失败！流浪地球让我看到了中国特效的进步，上海堡垒让我看到了韩国特效的退步！流浪地球让我见证了重工业电影的发展，上海堡垒让我见证了流量鲜肉的衰弱。,94
2021-01-30 10:18:20,凯恩斯吊打MKS,1,这确定不是用来洗钱的吗？,30
2019-08-09 09:47:42,Salted fish、,1,地球不需要伪娘来拯救,154
2019-08-11 14:53:38,momo,1,鹿晗和舒淇的感情线的确是很科幻。,45
2019-08-09 14:41:51,czwhx,1,也别骂演员了，这片难看其实跟演员关系不大,70
2019-08-09 17:53:08,渡口无边,1,烂得璀璨，蠢得绚烂。,72
2019-08-09 13:40:15,幽蘭漢化字幕組,1,演技差的还有下降空间,150
2019-08-10 10:09:07,Jupiter.lex,1,不要浪费钱了去电影院了，我宁愿花两个小时排喜茶,104
2019-08-09 13:39:47,托尼,1,"就鹿晗这作为一个军人留这大刘海。。。我对质量就不敢相信了上海堡垒最大的贡献，就是让投资方知道了，流量的时代结束了",98
2019-08-09 09:01:41,恃南林以司,1,你要改编就胆大点，把鹿晗这个角色删了留一个舒淇票房预期都比现在好。爱情想要傍上科幻，多少片子证明要么科幻是轻科幻给爱情留出戏剧空间，要么是硬科幻下把感情戏做成点缀因为宏大叙事下生存本能和探索精神永远占首位。蹚了那么多综艺你现在出来演戏，真不害怕自己存不住一点点表现力的神秘感吗？好题材粘了两颗粪蛋,134
2019-08-11 17:22:57,以小橘为重,1,作为一名场务少女，当我巡厅时，发现《上海堡垒》的客人溜进其他厅看电影的那一刻，我就知道《上海堡垒》不简单。这不是段子！！！这是昨晚的真事！！所以它已经被打入VIP厅了。我们电影院的VIP厅是放那些准备下映的电影的…,67
2019-08-04 22:15:14,茴香豆,3,额——看了首映，感谢豆瓣盗梦观影团……然后不多说了。,411
2019-08-04 18:17:17,穿山,3,点映场，能看但无趣。末日灾难题材＋爱国保球精神接棒《流浪地球》，甚至终极破局的方式也一脉相承（向我开炮→当场京了！）；这部剪辑没乱阵脚，出现危机→解决危机的主叙事线目标明确，故事讲得要比破球清楚；然而设定是很老套的抵抗外星人入侵，几乎每步措施都在预料中，新鲜惊喜度就不如破球了，综合起来打个平手吧。破球感情线主打亲情，打击面更广，沪堡走你爱我我爱她的暗恋向，受众较成人化，处理得很80后趣味＋电视剧feel（看过《此间的少年》一秒get，还是熟悉的味道），爱情戏份与战斗场面结合就有种星战mix新海诚的意思，尤其那个草地光柱夜空的场景，诚哥审美无疑了！比较忿忿不平的是好惨一潘队……要是我会气到头掉。总之希望中国科幻片能早日走出张扬大国自信的舒适区，有更多样的尝试。（为何找鹿晗舒淇主演？因为鹿加嘴）,204
2022-07-11 23:12:44,人文藝術,0,希望鹿晗别涂口红,1
2019-08-07 04:35:15,Galloway,3,2星半。有许多一言难尽的地方，也有尚可入眼的地方，但总的来说，瑕疵太多内核太弱。还有，导演不会拍人。,137
2019-08-10 10:49:48,风一样的傻子,1,太烂了，简直就是诈骗!故事没有一点代入感，演员假到极致，鹿晗是一点军人气质都没有，还指挥官，最后竟然当上了司令，但依然一副娘炮，当我们白痴嘛!看到后面 真希望外星人胜利，把这群人全弄死。,32
2019-08-30 17:34:37,老袁,1,大量内景，一到外景就跟JPG似的，完全没有细节；外星人就是一堆钢盔，出镜少得可怜；上海民众该吃该喝，啥也没落下。这样说投资了3个多亿，我是不信的。以及，鹿晗虽然表演僵硬，所有情绪都是一个表情，至少能看出来在“演”。舒淇真正的全盘放弃，可能片方花两个亿做了个舒淇Ai全息投影来出演本片吧，这样一切就解释得通了。,5
2019-08-09 13:54:01,萌少,1,向你开炮？你以为你是李云龙吗卧滴玛!剧情台词特效演技统统不在线，好意思和流浪地球比？中国科幻？How interesting!,65
2019-08-09 21:56:13,大吉,1,《上海堡垒》都说烂，我偏不信。看了一半，忍无可忍出来了，现在外面的凄风冷雨都是对我的无情嘲笑。以为看到了地球，中国的科幻不会差哪去，这部着实让我见世面了。槽多无口，不怪人演员演得不好，这本子道具真的不是过家家么。,68
2022-02-01 14:47:57,1874,1,我妈让我换台,21
2019-08-09 16:09:08,深山见鹿富平侯,1,谁来保护十里洋场，翩翩少年原来姓江。,30
2019-08-13 16:49:16,刘WoW,1,救救中国电影吧，开放零分选项,25
2019-08-09 11:47:50,素食de玉米,2,看的点映场，忍到现在才来吐槽，刚刚打了很多字，结果还被系统给吞了，那就简明扼要的再说一遍吧。江洋对林澜的感情毫无铺垫，单相思更像是剧情杀，至于着重刻画的战友情甚至比爱情戏更崩，泡吧戏尴尬的要死。场面上依旧延续了中国商业片抓大放小的毛病，乍一看似乎很宏大，但落到细节上，我甚至连外星人都样子都没怎么看清。还有一点，画面太干净了，放到世界末日的环境里充满了违和感。如果说流浪地球让我们看到了中国科幻电影的希望，那上海堡垒算是给了大家当头一棒，中国科幻还有很长的路要走啊……,34
2019-08-11 12:58:41,发条橘子,5,感谢《上海堡垒》，将响亮的一巴掌狠狠的打在把中国观众当傻子的资本、导演、编剧们脸上。流浪地球和上海堡垒，就是完美的正例和反例。如果经次一片，这些人还看不清事实的话。注定要被大势淘汰。经次一片，我仿佛看到好编剧，好导演，好演员们的春天到来！中国观众的春天到来！再次感谢上海堡垒！感谢鹿晗！,24
2019-08-13 00:07:46,豆友1776318,1,今日团建（？）集体观摩。就令人迷惑吧，没有一个地方节奏是对的，没有一件事是说清楚了的。有的烂片至少能令人发笑，但上海堡垒就，看完徐徐打出一个问号，并且因为太累了也不想多说。,15
2019-08-09 13:00:33,琦儿,1,什么烂片，一群面瘫演得一个毫无剧情的电影，为什么还有人喜欢鹿晗，面瘫伪娘，垃圾,7
2019-08-09 16:50:35,冷酷小圈,1,我撑了半场，告诉自己可以了,38
2019-08-11 16:20:45,邱润发,1,关于发型这件事鹿晗微博上解释过了，由于在上海拍摄，那边的发廊没有麻药，所以就没剪,18
2019-08-09 12:46:48,梦里诗书,1,末世科幻下一展纯爱，未尝不会是科幻电影一次新鲜有趣的探索，但对被流量绑架的《上海堡垒》来说，这却俨然变成了一场如坐针毡的灾难，正如同无数滥竽充数被架空了历史的纯爱影视剧作一样，那千疮百孔的剧情，一言难尽的演技，都彻底毁了电影本并不算差的特效制作。,74
2019-08-19 00:58:12,⊙_⊙,1,如果把舒淇换成蔡徐坤，我这副牌将叫绝杀，可惜换不得。,25
2019-08-09 22:36:10,起司土豆泥,1,从头到尾，就几乎没见过一句台词对上口型的是怎么回事？？？这也是科幻的一部分吗？？,58
2019-08-09 17:35:21,李知恩,1,能不能对我们高烧39.7还在坚持跑路演的鹿晗哥哥善良一点？？？,13
2019-08-31 01:05:36,安蓝·怪伯爵𓆝𓆟𓆜,1,额滴老天爷……导演，不是我说你，讲实话俩主演你哪个没用错啊？不用觉得是舒淇就不敢说好吗……,6
2019-08-12 19:11:15,一秒快乐,1,本片是流量明星的坟墓，具有重大意义。,26
2019-08-09 12:40:29,清者自清,1,鹿晗的刘海可以再厚点，最好到四十五十岁时还能顶着一头浓密乌黑的刘海中分演戏呢,68
2023-01-15 12:10:14,托马斯•维德,1,2023.1.15 12点30分六公主正在热播…,13
2019-08-18 03:28:52,Superhat,0,说实话当年今何在和江南网上互相问候的时候就不站江南，过几年再看他的作品改成电影就知道最早不喜欢的人后来你还是不会喜欢，这种就着末世谈恋爱的老套故事当年能卖钱我都各方面服了，不正是非主流热潮带出来的假爆款吗？放五年前鹿晗正火舒淇正俏的时候可能还能骗一波，偏要拖到现在，更何况科幻完全不成立，上海一片岁月静好，连诺基亚都还活着，你说地球危在旦夕？所有队友的死都一万个不值得，遗物有复古机车和永生花，是QQ秀审美吗？舒淇穿制服耸肩驼背一万个不情愿，全员配音嘴型对不上，就这拖沓而虚假的感觉，以为自己在看泰国科幻。称敌军主舰为“母舰”一口一个mother ship，瞎了，差点要了我的老命。贵“母舰”两次来都停在同一个地方打，想必也是很有大爱了。,8
2019-09-02 17:11:29,开膛手贝塔,1,完全不知道导演的心思放在什么地方。同样是外星人来了，同样是用新闻资料片作叙述，你看下《降临》咋拍的，人家就是视频加主持人画外音就完了，你恨不得导演亲自出来弄个背景阐释了。电视剧导演拍电影，真是小孩子玩避孕套，一言难尽。,4
2019-08-09 15:45:32,小小飞行员,1,怀疑这部片子在洗钱,14
2019-08-09 17:35:37,404  not found,1,独立日2和洛杉矶之战还有流浪地球太好看了,53
2019-08-12 16:14:33,热狗的小老弟,1,其实也不能怪鹿晗，毕竟鹿晗过气了，如果换成蔡徐坤的话无论是从票房口碑来说一定会更低的😂,16
2019-08-11 16:39:39,ㅤ,1,今天去看上海堡垒，看到一半，我前排一阿姨就吵吵闹闹的说:不看了，什么垃圾电影!我这暴脾气，上去就是一脚，你吵什么吵，没看见大家都睡着了吗？,38
2019-08-12 17:23:17,已注销,1,遗物盒要本人指纹才能解锁你他妈是在跟我开科技玩笑吗？,24
2019-08-13 13:41:52,Ciri_,1,作为一个美术生 不说电影剧情 从审美的角度上来说 就这电影海报封面的设计排版水平我还以为电影上映在二三十年前 还有主角们穿的制服 怕不是直接拿的当年迪迦奥特曼胜利队的队服直接换成灰色款就上了 幼稚得一披 世界观都是若干年后的地球了 打仗还是普通的步枪、普通的坦克、普通的装备 连外形设计也如此普通有可能连设计都没有直接上现成的 wtf？除了上海大炮外其余的军用科技武器一点金属的厚重感都没有（对比看看的环太平洋1的机甲）对外星人的刻画几乎为0 反正向堡垒冲冲冲就完事了 还有上海的场景 本来以为会渲染成中国特有的未来塞伯朋克城市 结果电影里这所谓的高科技科幻上海和我一个月前去教学考察时的上海真的一模一样 这也配交科幻片？？？整部电影的造型概念设计严重缩水 又把钱全部拿去请🦌含了？？？,19
2019-08-09 15:55:09,远辰,1,有些国产电影，你把它拍死才是对国产电影做贡献,12
2019-08-27 12:59:04,初音大西王,1,2.5分，很好奇为什么会被喷那么烂，就在网上找盗版看了。虽然没浪费钱，但却浪费了时间，心里好郁闷。这片还不如独立日2。鹿晗指挥军队的声音好像是在指挥小伙伴玩网游刷怪，这场战争简直形同儿戏。鹿晗的发型没的洗白，升官了这发型还不改。特效勉强合格，但比起流浪地球可差远了，激光与爆炸还没泰迦奥特曼好。,13
2019-08-09 13:50:55,Eurus,2,中国科幻电影的发展就像是一场接力跑，《流浪地球》好比是一个初出茅庐的青年小将，虽达不到炉火纯青的水准，却也是把国产科幻的僵局撕开了一道口子；今天我所看的《上海堡垒》，就好比是一个还在蹒跚学步的婴儿，从特效到剧情再到演员演技没一个在线的，你让他上跑道接棒，不仅棒接不住，还要狠狠地摔一跤!,30
2019-08-09 10:38:15,Happy Together,1,不仅鹿晗 舒淇也是演一部扑一部,32
2019-08-09 09:00:53,小绿光,1,非常不错的烂片,94
2019-08-09 10:46:56,泰勒发现爱,1,一分给特效吧……演技真的劝退……,22
2019-08-09 10:29:53,木石子,1,其实你们都误会《上海堡垒》了！如果说《流浪地球》开启了“硬”科幻电影类型，那这部电影绝对是“复古”科幻的鼻祖了，就拿上海大炮来讲，二战以后大炮就已经退出历史舞台了，导演这次再把它请了出来，为的是什么？不就是为了迎合复古的主题吗！更别提还有堪比大哥大的电话......导演，咱们私聊哈~,51
2019-08-11 10:51:03,南京无泪宝贝,1,就凭粉丝恬不知耻的尬吹，这个片就注定无法在口碑上有所进步。但我们应该庆幸，2019年了，流量明星，不行了。,32
2019-08-31 02:02:17,空巢脑仁玥小饼,1,我没有倍速播放，甚至看到片尾字幕播完，希望能从这个大家都说烂的片子里找到超过2星的理由。我尽力了，但我真的没有理由给这部电影打1颗星以上的分数。,8
2019-08-10 13:20:11,空挡,0,这或许是利用“粉丝经济”拍的最后一部电影了。想想也是值得高兴的事。,18
2019-08-30 20:12:07,мая,2,4，烂的很平庸，跟富春山居图不是一个档次的,4
2019-08-11 10:49:25,Joker,1,明知山有屎，偏向屎山行😒,14
2019-08-09 10:37:18,瓜果蔬菜批发,1,原著就是科幻背景下的爱情小说，大ip+大流量，导演制片方明显想吃快餐多过做好电影，最后搞出个四不像，对这种片子就是要零容忍。,24
2019-08-11 04:57:55,Otter the Ole,1,下午去商场买衣服，顺便看看电影，毕竟中二时期还挺喜欢小说。看了半小时退场。别的电影打一分是因为值一分，这部电影打一分是因为最低只能打一分。,39
2019-08-09 10:32:25,英吉,1,不要编剧，不要导演，摆明了老子就是来圈粉金，那么我还敬你是条汉子，说不定买张票，钱到人不到。,83
2019-08-10 12:52:01,芭拉芭拉朵蜜你,1,看了主演就知道是屎，非要自己去尝一口确认下的我,15
2019-08-12 23:50:20,晚晚太子湾分晚,1,最后悔的就是浪费三十块看发型光鲜亮丽的鹿晗拯救一个房子都没塌几个的上海,11
2019-08-09 15:23:39,私房歌,2,遗落在角落的书沾满灰尘，也已发黄。原著粉表示，很有热血，但是没有情怀。,23
2019-08-10 00:57:43,李乱,1,看到很多人骂《上海堡垒》烂，我有点气不过，评价一部电影自然要客观，如果说《流浪地球》为中国科幻电影打开了一扇门，那么《上海堡垒》就是咣当把门给踹上，还特么搬来沙发顶上了。,41
2022-04-01 11:17:16,C-927,5,昔有上海堡垒打外星人逛街遛狗今有疫情防控的上海人无所畏惧,17
2019-08-09 11:55:22,一,1,年度十大烂片，浪费时间,71
2019-08-10 11:40:09,无事生非,1,主要问题在我。周六起个大早来看这破烂儿我不是有病是什么？,17
2019-08-11 21:29:32,""" 小柒童学",2,粉丝一味的捧杀 并不会让一个快30岁的人意识到自己演技有多差 只会让他原地踏步毫无进步可言，那请问当流量时代结束，年龄增长，后辈崛起，他呢？要作品没作品，要演技没演技，只有那张老去的容颜，到时候演艺圈还有他的一席之地么？,18
2019-08-09 13:51:14,哪吒的诡计,1,怪不得上海总问你是什么垃圾？？,18
2019-08-11 07:22:05,大脸猫爱吃鱼,1,一个喜欢江南的妹子请我看的，没办法。看了一半，我俩离开去做爱做的事情了,30
2019-08-11 09:10:48,￼,1,上海堡垒这部影片很好看，特效是真的好，服化道是真的棒，剧情跌宕起伏，演员演技都在线。推荐大家去看，不能让我一个人花这冤枉钱。,38
2019-08-13 09:42:38,随时随刻随心,1,2019年8月9日以鹿晗为首的小鲜肉主演电影《上海堡垒》上映。至此，历时180多天以吴京，刘慈欣为首的流浪地球变法彻底失败，中国科幻正式走向灭亡，史称科幻百日维新！,32
2019-08-11 13:24:49,🔥,1,上海堡垒这部影片很好看，特效是真的好，服化道是真的棒，剧情跌宕起伏，演员演技都在线。推荐大家去看，不能让我一个人花这冤枉钱。,28
2019-08-07 01:52:35,叫什么名字好呢,1,年度最烂。剧情就是打打打+谈恋爱，循环三次结束。战争场面毫无美感，感情戏尴尬单薄，两部分完全割裂，抗日打鬼子片都比这好一百倍。鹿晗的粉丝们，看你们的了。,78
2019-08-10 14:35:14,穷宇极宙,1,都未来世界了，演员的军事装备还弄得跟小区的臭脚保安一样，这淘宝包邮的迷彩裤和帆布质感的臭靴子是要拍小区堡垒么？再看主演这犀利的发型，配上这身二流小区的保安的套装，这简直就是从农村招来了哪个不良杀马特青年啊！快看主角居然再打情骂俏，都要世界毁灭了，主角这个杀马特武装保安居然还和二流小区里的某个玛丽苏剩女不停的打情骂俏。主角作为一个小小的杀马特保安面对外星人入侵而如此淡定真是可歌可泣的视死如归的伟大而光荣的保安精神啊，这个二流小区一定能成为人类文明的方舟啊！,17
2019-08-09 20:19:57,执理性之剑,1,让我们一起庆祝 小鲜肉的时代基本结束了,6
2019-08-12 14:48:53,鹿鸣先生噢,1,鹿晗的粉丝也知道口碑烂了就无法逆转，开始转移视线，把矛盾引到导演身上：电影不好不能赖演员，是导演和编剧的锅啊！如果电影很好看你们猜他们会怎么说？“鹿晗的演技真棒👍”，史诗级的烂片，小鲜肉终归只能骗骗粉丝,26
2019-08-09 09:51:44,.,1,鹿晗真的丑的绝了，演技毫无进步，这剧情就是披着科幻片的外衣搞对象,22
2019-08-11 10:47:26,AryaStark,1,上海堡垒这部电影，建议大家伙都去看看，不能只有我花了冤枉钱。,58
2019-08-31 19:26:12,品客,1,环黄浦江,5
2019-08-20 14:59:47,_Hobgoblin,1,有鹿晗这种不男不女的演军人 侮辱军人吧,15
