time,user,rating,comment,votes
2019-11-10 00:59:05,不要再划了,2,前三十分钟：这片还行啊没那么烂啊掏枪对射外星人之后：？？？再后面 一会战争一会和平 节奏太奇怪了 战争不那么紧张 也没啥逻辑 为了救泡防御去炸主服务器来启用备份服务器这种情节 看似说得通又让人难受 好容易有点紧张了 就短暂和平了 男女主迅速谈恋爱去了 吊的我不上不下非常难受最后结局我差点没看懂作为江南淑芬 我看完电影花了俩小时补了原著 发现原著就是一会战争一会和平来回切 虽然也不是啥很好看的小说 但比电影舒服多了,2
2019-08-11 13:12:51,桔梗,1,因为黑子太多，上海堡垒是个好片，演员的演技十分出色，虽然是配音，但是对上的地方特别多，最需要夸赞的就是特效，相当震撼。还有剧情一些细节，简直了， 推荐大家去看看🐶。毕竟，冤枉钱不能我一个人花。,11
2019-08-13 07:41:36,奶茶呀,1,电影看完之后感觉我眼睛眼瞎了，剧情和演员尴尬的演技，甚至连配音都不一致，最可恨什么超话2400亿？全中国给你点计170多次？还什么微博颁发最受期待男演员奖，一个敢颁发一个敢领。脸是什么东西？,26
2019-08-09 14:55:19,豆友182618232,2,你见过哪个军人有刘海？,13
2019-08-10 13:13:25,Gentleman,1,梳中分拯救地球，属实🐮🍺敖，再穿一身背带裤军装，外星人还以为是cxk,31
2019-08-11 07:54:33,雷碧,1,之后还是得靠明日战绩啦,19
2022-07-27 20:46:46,STEVENSHAW,1,都世界末日了上海百姓还可以在夜店蹦迪狂欢，然而2022年的上海人民却被疫情折腾得足不出户，理想与现实的差距总是这么赤裸裸。,8
2019-08-09 14:00:06,湮灭,1,如果要我发表长篇大论来证明这是一部烂片，那简直是对生命的浪费,16
2019-08-31 10:50:42,万户,1,感觉全员都在摸鱼，导演摸鱼演员摸鱼编剧也摸鱼。十年前自己喜欢的小说以这样一种结局收尾，也挺恶心的。,3
2020-02-04 13:10:19,Raven,1,上海做错了什么，,3
2019-08-09 12:14:51,烂片鉴定员,1,这样的烂片真的无力再吐槽，抱着浪费几十块的心态看看烂到什么程度，可没想到看半个小时就无法看下去了，赤裸裸的洗钱骗钱的超级烂片！鹿晗你以后别在糟蹋电影了，还是回家去找个男人嫁了结婚生子吧！,31
2020-01-09 01:30:00,秋天的黛西,1,因为有8分钟高以翔的cult ，不然五灯全灭。,4
2019-08-11 07:52:05,笑逛人生,1,都这年头了，居然还有用娘炮演这类型的片子。导演脑袋秀逗。。。。,34
2019-08-09 14:55:28,冂丅貓,1,参加了试映会，因为遵守保密协定一直憋着没吐槽，只记得当时在影厅里总想按快进。终于盼到了上映，看到这么多一星点评，我就放心了……槽点太多了，鹿晗的演技、强尬cp、儿戏的剧情、过时的特效、……唉,61
2019-08-10 00:51:52,深夜声噎,1,如果不是白嫖IMAX谁要去太空堡垒，白嫖完觉得后悔了亏了亏了。极简生活，应该果断放弃大部分烂片，满足看最多好电影好剧的热情，人生太有限！时间不断流逝，等待下载都觉得浪费，5G时代快来啊，我太难了。,13
2019-08-26 10:29:01,国王KING,1,《流浪地球》好不容易才让大家建立起了对中国科幻的信心，而《上海堡垒》扑了大家一头冷水。这部片应该钉在中国科幻的耻辱柱上。,5
2019-08-11 18:37:25,蒸鱼爱装13,1,自己的遗物…需要自己的指纹打开……？导演你是认真的吗？,29
2019-08-09 16:25:18,傲视群熊,1,我觉得他们这是在洗钱 除了这个可能 我实在想不明白 导演 纸片 到底为何能拍出这样的东西 还信誓旦旦的说不会让影迷失望 甚至把这东西跟流浪地球相提并论 真是恶心！,57
2019-08-10 12:25:19,么么有房要转租,1,鹿晗太跳戏了 明星就是明星，不要做演员了,8
2019-08-23 22:59:46,肥仔,1,建议豆瓣在“想看”和“看过”旁边加一个“不想看”和“不要看”。,14
2019-08-10 09:02:12,西瓜薯片可乐茶,1,当喜剧片看我给你一星。当灾难片看……那片子本身就是个灾难。主要问题在于哪儿哪儿都不行，剧本导演特效演员，没一样能拿出手,15
2019-08-09 22:51:04,張佳樂,2,怎么做到科幻爱情两头误的？,35
2019-11-09 20:59:48,目标170,3,鹿晗和舒淇的电影。豆瓣评分2.9分，我却看着有点意思。看来我真如懂懂老师说的，我的水平已经低于中国，80%的初中毕业生了。豆瓣，把鹿晗变得一塌糊涂。但是，这样的演员就是买脸的，你还想要啥。但是我注意看了一下，这个评价人数有21万之多，估计票房少不了。6.5分,1
2019-08-09 09:17:10,不歪の太,2,再见,53
2019-08-12 01:34:02,胡同串子,1,"影视投资人可能有个误解，有的明星看上去粉丝拥趸很多，可其实只是他的粉丝比较“吵”，比较能闹而已，所以看上去人气爆棚流量极大。而很多真正会演戏的影人的粉丝其实更多，但只是不那么爱说话，也不爱出来吵吵，不会因为某人说了不同意见就出来骂街，有组织有纪律的群起而攻之，所以看起来没什么流量和话题性。而能闹能吵的粉丝通常智商都不太高，所以现实生活中活的貌似都不太如意，很可能连张电影票钱都拿不出来，而真正好的演员好的作品，才会让人掏钱。另外，爱跟风可能在各行各业中都存在，火了一个流浪地球马上就有人搞上海堡垒，有句糙话，叫别人嚼过的馍不香。最后，希望这种把钱砸在特效尤其是明星上的做法能改一改，（阿修罗的前车之鉴看不到么？）一个好的故事，才是影视的基础。",24
2019-08-09 13:00:40,西奥,0,哪吒可以放心大胆的向前冲了,4
2021-01-30 13:18:29,Kanon,1,幼稚拙劣的“外星人入侵地球”…,4
2019-08-31 21:49:15,鬼腳七,1,其实也只是普通的烂而已嘛……喊了“向我开炮”但是没死，这属于政治错误,7
2019-08-09 00:32:21,ABIH,1,说特别尬也不为过，故事逻辑也是一言难尽，总之就是省点钱吧，别看。,76
2019-08-09 09:18:37,世界无雨,2,满怀期待去看的，以为是一部科幻力作，结果只是披着科幻的爱情片，有点失望。,33
2019-08-10 02:46:14,JoeyLu陆柏宇,1,非！常！的！难！看！,25
2019-08-16 15:05:19,湘苓,1,收棺之作,13
2019-08-10 08:27:19,惊蛰,1,看男主这个发型就劝退，我们国家的军人没有这个德行的，谢谢,36
2019-08-14 03:40:35,橙子,0,说中国科幻止于上海堡垒真的是过分了，上海堡垒真的没资格代表中国科幻。我也是搞不懂鹿晗，身边有朋友曾经特别喜欢他，听多了有点了解。这哥们唱歌真的不赖，唱功在众多小鲜肉中也算有较高水准，前两年唱的《重返二十岁》《勋章》现在还在我的歌单里面。明明有些好嗓子好唱功，跳舞也不赖，偏偏做着最不擅长的演戏，反而专辑歌曲给拉下来了。前几天看到他的采访，说观众要给新人机会，不要一看到自己就觉得是烂片。关键是市场已经给了你六七年的机会了，在这期间路反而越走越歪，还要观众怎么去包容你啊……,17
2019-08-10 14:25:55,星岚dream,5,特效是很棒的，尤其是上海陆沉那一幕，非常壮观，但是可能由于时长，删减了太多文戏，导致普通观众没有太多代入感。不过对于我来说江洋对林澜的感情，林澜对江洋的回应，都让人动容，即使有不足，但也不应该是这样的评价。,19
2019-08-09 13:37:04,Lynn职业制冷师,2,我觉得我走错场子了，我看了好多球球掉落到上海，变成一个个三头六臂的家伙，然后他们被一个从海上出来的东西搞死了。——《上海堡垒之魔丸降世》观后感,28
2019-08-12 13:00:14,子不语,1,中国科幻好不容易燃烧点火种被鹿晗尿熄了，TMD还是蹲着尿的！,16
2019-08-10 13:14:52,什么是演技,1,鹿晗这种垃圾演技别出来骗钱,26
2019-08-11 05:24:47,岁月无声,1,《上海堡垒》的上映过程，就是片方自己知道它是个烂片，观众都知道它会是一个大烂片，片方也知道观众都知道这是一个大烂片，然而片方还要假装观众不知道这是一个大烂片，还花了不少钱做宣传，希望多少能骗一点不明真相的观众，不然3个亿的投资就只能打水漂了。我想导演此刻应该有很多后悔药想吃吧！,30
2019-08-12 12:31:45,李湘,3,演员们演技还是不错的呀！舒淇一心保卫地球！压抑着个人情感！鹿晗热血！保护队友！又单恋着舒淇！王宫良、王森和孙嘉灵和鹿晗！四个队友青春热血有梦想！就是高以翔显得有点格格不入。我看不出来，高以翔喜欢舒淇。,5
2019-08-09 12:52:05,老李,3,我真是本着对舒淇老师常年的喜爱给三星的，整体上都不太行，既没拍出主角成长线，也没有拍出末世感，文戏在鸡皮疙瘩袭击中度过，动作场面只拍好了最后一场，滕华涛作为一个中老年男导演不会借鉴还严重缺乏想象力，好歹从《独立日》和《星河舰队》里抄一点，也不会如此乏味无聊,28
2019-08-10 09:07:19,阿易,1,头可断，血可流，发型不可乱。,9
2019-08-04 23:57:25,傅尔曼,2,银河补习班，烈火英雄，上海堡垒，可以封为2019哭不出来三部曲了，目测未来还有大量这种片子。原著是披着科幻的爱情片不错，但是改编也可以弃其糟粕，而不是现在扭扭捏捏，两条线难以交融的状态，更别提每条线都难以自圆其说。一星给特效，一星给舒淇。,22
2019-08-09 10:38:10,约翰韦伯金,1,鹿晗还是。。。别拍戏了，唉,28
2019-08-09 19:40:55,火大男孩,1,此刻的我正在电影院玩手机,16
2019-08-14 03:25:33,PK,1,感谢鹿晗这次拯救了中国电影，他让所有资本都知道鲜肉经济已经穷途末路了,34
2019-08-10 02:24:37,樹,1,无法评价,14
2019-08-10 14:24:50,Lithromantic,1,看见微博还在吹，欺骗路人浪费票钱，恶心到我了,17
2019-08-13 04:35:28,一团云,1,太难看了 以后要听网友劝 说难看真的不要浪费钱去看了唉,15
2019-08-11 10:17:56,llcatj,1,制片方投资人都睁大眼睛看看吧，现在群众的眼睛是雪亮的，没有那么好糊弄了，以为请个小鲜肉流量明星就有人买账了？我们看中的是影片质量，真搞笑〜(￣▽￣〜)呵呵哒,18
2019-10-30 21:12:38,陈春先,3,没有风评那么差。我猜测这导演潜意识在对标《独立日》，但确实差一大截。剧情太简单，结尾太磨叽。演员的表演不算浮夸。从设置上取消了我党和解放军，甚至RPC，还是挺失败的。美国总是借着这种主题凸显美利坚合众国的优势，我们该好好学学。,2
2019-08-25 00:35:01,Angelababa,1,都未来多少年了 黄浦区老房子还没拆迁,7
2019-08-15 14:41:43,古城茶博士,1,《流浪地球》最近成了最无辜的躺枪侠，躺枪的原因无非是自己费劲巴力的开创了中国科幻电影，还没捂热就被《上海堡垒》给彻底凉凉了！电影院里一片哀嚎啊！其实准备看这个的时候我就觉得能到《环太平洋》的水平，没有1那个质感2了我都没意见，结果竟然连《环大西洋》都不如，投资了那么多亿，39°路演卖惨，道歉……还有什么都一并爆出呗！5000万粉丝的流量巨星就这么凉凉了？导滕，继续导滕，就想问问滕导，您这是准备和那个逼叨叨不停的毕导联手打造大陆最扯电影的节奏吗？,13
2019-08-12 23:51:45,Entropy,1,不出所料，科幻线，爱情线双崩,13
2019-08-12 01:59:37,幻,1,长发的军人，呵呵哒，连基本常识都没有,19
2019-09-16 01:27:27,醉饮狂歌,2,影片唯一能看的是开场一分钟介绍仙藤的段落。。。。其实影片最出戏的地方在于后期配音和演员嘴对不上，非常滑稽。 PS 其实特效还是能看的,2
2019-08-09 20:56:05,甫陵,3,有的东西只有文字才能表达吧。看到剧中依然用了潘和曾的名字，不由想起江南在《九州幻想》06年4月刊的卷首语。这么多年了，也不知道猴子放下没有，都是奔50的人了，时间好快的啊。,12
2019-08-11 17:29:17,一血小王子,1,不夸不吹，这确实是一部合格的科幻烂片👍👍👍👍,23
2019-08-09 11:55:57,Gao,1,科幻是外皮，言情才是卖点，而且导演对这方面的理解还停留在他对烂俗电视剧的理解上。不是人类都已经此诚危急存亡之秋了，走点心好吗？逻辑设定上的漏洞暂且不说，整部电影就是一场自我感动式表演。科幻场面只是伪高潮，言情才是衔接的地方。结尾无限播放自我感动式的言情场面语录，而台词就是一个标准的小学生作文，将那些谁都知道的大道理当做口号喊出来，再配上通俗到爆BGM，简直自我意淫的感动。结尾音乐响起的时候我还以为是校园恋爱。讽刺的是影片竟还响应了一下领导人说的“年轻人”是，希望就在三个年轻人手上了。结尾彩蛋还为抖音宣传了一下，鹿晗的演技就是在敷衍，还是回抖音上表演吧。毕竟是培京大学毕业。言情不言情，科幻不科幻，这样的107分钟真是碉堡了。内在早已腐朽，剩下的就是自我感动式的意淫，空想主义式的口号。,36
2019-08-11 20:19:36,尚在影,1,为中国科幻电影画上圆满的句号。,10
2019-08-10 08:24:25,米线er,3,"特效在我这是合格的，毛病也显而易见节奏掌握的不好。鹿晗在里面完成的绝对不拖后腿，为了黑而黑真的挺没意思的，估计是抢了他们女神吧，但是没鹿晗人也不会看上你。最后感谢周杰伦，片尾曲一出太震撼了～",22
2019-08-09 15:58:27,杨公子的黑,1,呃，不想说话,43
2019-08-09 15:44:47,Trance,1,以为靠流量就能圈钱的导演们，醒醒吧，现在已经不是你们的时代了。,55
2019-08-11 13:35:36,低谷有雾,1,鹿晗如果真的想做个演员，还是应该先摆正姿态！看造型就数他最突兀，眼里就不说了满屏的尴尬，唉,9
2019-09-04 11:25:02,___李小白。,1,看眼盗版都是对你最大的褒奖了！！！！！！！,4
2019-08-13 14:44:26,小番茄苗🍅,1,真的 为什么 单位要请我们看这个电影 为什么。。。。。。,8
2019-08-10 08:39:41,мимоза,1,明明大家都是说这个片烂，导演编剧主演明明都得背锅，怎么粉丝总说是对流量的偏见？真没偏见，就是从头到尾的烂...,25
2019-08-13 13:25:01,老公天下第一好,2,卧槽哈哈哈哈我惊了，我的上一条给五星的同志给鹿晗的甜蜜暴击和择天记四星哈哈哈哈哈哈，然后给了关小姐和迪丽热巴的作品一星哈哈哈哈哈xswl，现在追星那么没脑子的吗哈哈哈哈,9
2019-08-12 23:22:05,吴小雨007,1,哎，一个娘炮演军人。真的是不堪入目。浪费老子钱,16
2019-08-10 14:46:22,路小佳,1,中国科幻的希望在《流浪地球》，绝望在《上海堡垒》。,29
2019-08-09 14:49:55,再无瓜葛,1,观众看完都流下悔恨的眼泪,14
2022-02-19 13:31:24,oyster,1,鹿晗能换成张一山，我觉得票房还能再上几个档次,2
2019-08-10 04:00:48,克里斯呆娜,1,不看这部片子就是支持国产科幻,34
2019-09-01 21:45:35,某茶君,2,没有一片雪花是无辜的。,3
2019-09-18 13:43:50,椒盐豆豉,1,天线宝宝都比这个好看吧…鹿晗咋残成这样了？老了老了。话说一直搞不懂大陆电影为啥要坚持配对不上嘴形的音？,2
2019-08-09 13:03:39,有风自南,1,中国科幻可太难了，年初刚萌芽，不到半年就快入土了。😅😅😅,12
2019-08-09 16:36:27,晓晓晓,1,流浪地球为中国的科幻翻开了崭新的一页，上海堡垒合上了这一页,34
2019-08-09 19:22:42,林云开,2,地球都要毁灭了，陆家嘴竟然还在上班。,6
2019-08-15 03:17:32,吸毒欧阳疯,1,能让毕志飞感到威胁的电影,24
2019-09-04 00:16:53,有寂,1,我记得很清楚第一次看上海堡垒是09年，那年我高一，从来没想过会去上海上学，江南大概是我那会儿最喜欢的国产作家，喜欢他书里的少年气，喜欢上海堡垒，觉得这个故事只能发生在上海。现在我在上海待了七年了，即使在我对着房价望而生畏的时候都从没如此希望上海立刻马上沉没或者爆炸。但我还是更心疼在影院里看这个情节如同小学生玩山寨网游画面如同某种不入流主机游戏mod的电影的观众，至少在电脑前，我还可以飞速快进。,4
2019-08-31 22:37:16,Panda的影音,1,2019年8月31日《哪吒之魔童降世》超越《流浪地球》升至中国总票房榜第二位，登顶2019年度票房冠军！《哪吒之魔童降世》能能取得今天的成绩，《上海堡垒》口碑票房双扑街也起到了推波助澜的作用。,6
2019-12-06 11:51:03,千寻亿选,2,其实也没那么差，至少特效还能看。我对类型片比较宽容，比如怪兽片只要怪兽够大够猛就行，剧情无非是两脚兽花样作死。惊悚恐怖片只要能吓到我就OK，功夫片只要动作场面合格就合格，科幻片嘛特效及格了也能看，剧情无所谓，美国大片独立日还有给外星人下电脑病毒这种超级BUG的剧情呢.。要说这部电影的票房和口碑双双大扑街还是主演的问题，三小四大顶流里就属鹿的路人缘最差，之前就常常在一些短视频里刷到有评论这块石头的演技都比鹿好，这条狗的演技都比鹿好等等，点赞数很多，路人缘可见一斑。加上他本身的一系列操作比如公布恋情导致大量粉丝脱粉，蔡徐坤等新一代流量的上位抢走了不少粉丝，最终导致了上海堡垒的大奔溃，广大路人的喜大普奔集体反戈。想想几年前鹿的一条微博还破世界纪录，上海外滩的邮筒前长长的女生队伍,1
2019-08-09 20:21:03,文真则,1,我他妈真的是瞎了眼才会去看,8
2019-08-09 09:35:55,北凌,1,一星给舒淇，LH能不能别拍戏了，这不是强人所难么？？,90
2019-08-10 02:15:34,扶离,1,看主演是谁我就大概知道水准了。。。,31
2019-08-09 09:52:46,Devin,1,让我口吐白沫，先抽搐会儿，low到哭泣,25
2019-08-09 16:29:35,杰瑞的胸肌,1,请不要蹭科幻片热度，靴靴！！！,23
2019-09-02 15:57:21,一二三木头人,1,为什么不能有0星这个选项啊...真的没看过更烂的电影,5
2019-09-02 23:42:32,Sunshine,2,从这图和预告片来看，我感觉要扑街，票房不过5亿。以上是当初说的判断，看来5亿还是高估了，最终只有一亿多一点。一部披着科幻战争外衣的莫名片。说爱情，鹿晗和舒淇毫无CP感，感情线没有丝毫铺垫。发几条短信，就让江阳爱上林澜，太唐突了。其他我的担心几乎全部验证，特效差，这3亿制作费花哪儿去了，外星人捕食者无人机和战机都假得像网络游戏。已经能抗衡外星人的未来，上海还是没啥变化，除了多几个大屏幕广告屏。却让整个城市显得没有美感，很突兀，是像模仿赛博朋克风格么？不伦不类。鹿晗作为一个主演，全程几乎一个表情，呆呆的，仿佛不知道自己要做什么。影片节奏也很奇怪，前半程打打打，中间突然来感情戏了，最后又打打打，战争戏很突兀，感情戏同样突兀，总之很莫名其妙。一个成名导演拍出这样的片子我不得不怀疑他是不是嗑药了。3分,0
2019-08-09 12:25:31,口水哗哗流,1,江南太垃圾了,11
2019-08-09 12:28:28,沉酣一梦,1,当兵的有留那么潇洒的刘海的吗？您是来选美的吧？还有别每次说演技差粉丝就说是歌手，是歌手就去唱歌，又想演电影电视又拿歌手做批评的挡箭牌，哪有这种好事？合着你是免费出演的？,51
2019-08-09 19:05:51,小弟,1,尝试了一下烂片的感觉，果然还是很深刻,6
2019-08-09 19:33:12,童甄,1,今天一睁眼就被4点几的评分吓到了，想着再烂也不至于开画如此之低（内心期望值是6左右开画），何况有流量粉丝撑场面。于是把晚上的行程安排到了中午，IMAX厅30人左右。影片开始就被这景象给搞懵逼了，这是未来的场景吗，这是未来的军队装备吗？开始鼓吹的特效呢…这特效别说3亿了，就是300万的都比这个强数倍吧。这还用数年时间创作？有没有搞错啊，我是奔着科幻题材来的，结果几乎看了一部关于暗恋的故事，把台词换一下，绝对是部不折不扣的甜蜜姐弟恋泡沫爱情，结局硬要扳成CP来恶心人。当然看到这里我似乎明白开篇这么差的原因了，不单人物不行，而故事也没故事，场面没场面，粉丝自嗨当然更让人厌恶了。关于此片说烂片是对中国电影最大的尊重。,29
2019-08-12 06:13:08,鬼画符,1,鹿晗……  OMG！为什么这种没有实力的娘炮这么红！与李宇春有异曲同工之妙……,22
2019-08-13 11:56:53,骑着毛驴去流浪,1,如果电影可以分类，这部电影属于有毒垃圾一类，就鹿姑娘主演这一条，给一分是妥妥的了。我觉得中国军人应该把他抓起来，有辱军人形象。千万别去看，千万别去看，千万别去看,20
2019-08-09 16:28:27,明光暗影,2,高以翔专门负责打炮，这谁顶得住啊，前后打了三炮，外星人都顶不住，挂了。鹿晗也忍不住冲高以翔大喊：“向我开炮！”，舒淇见状只好幽幽叹了口气，每天都发来条短信：“好好睡，晚安”。还好，居然能看下去，就是太严肃太悲壮太紧绷了，没有原著小说的幽默好笑，另外，原本“多角恋”的爱情戏份其实也减少了。虽然无论是电影版还是小说，我都不相信他们能够拯救上海拯救世界——事实上，小说里就不是我们人类救了地球。但至少小说里的人物还是比较有趣的——“不正经”又有血有肉，不是光顾装帅，最关键的是还真的是有心理的成长过程。。。,15
2019-08-11 13:43:51,馒头,1,我看过了，很棒，演员演技好，剧情逻辑清晰，而且特效堪比好莱坞一线，主角的爱情更是可歌可泣，强烈建议去看。毕竟，冤枉钱不能只有我一个人出。,9
2019-08-10 23:39:12,🕵️阿一古,1,一星给鹿晗唱的《世界末日》，唱的还不错，剩下的真的就剩下圈钱了，还好现在观众的品味提升起来了,13
2019-08-09 10:25:22,团小纸,2,真人版的高达，还是最差的高达，就这么理解一下就没那么生气了,22
2019-09-09 07:59:31,三魁,1,《堡垒》过后，哪部电影再想用“上海”这个名字，需要全体上海人表决！！！,6
2019-11-13 14:42:10,xm配角控,3,前几天还是看啦江南老狗恰饭难看现场但没想到评分那么低哈哈(如果不是豆瓣最低只能1星2分的话，我猜测分数可能会触底详见影评啦,2
2019-08-19 16:43:33,[已注销],1,鹿晗是谁？就是拍上海堡垒那个！！,7
2019-08-16 06:41:10,小方方爱小兰兰,3,还好吧，其实也没有这么差吧，舒淇还是不错的,3
2019-08-11 11:06:17,福贵叔叔,2,就剩下一个上海，外星人这是走的农村包围城市的路线吗？,25
2019-08-10 19:36:30,穆子衿,2,有些东西过了一段时间以后去看，能勾起回忆，产生情怀。可有的本就是一时兴起，时间过了，则烟消云散。这部电影与其说去批评和攻击演员，不如说是编剧和导演的责任更为重大。爱情片不相爱情片，科幻片不是科幻片，再加上原著本来也就没啥值得回味的情节和设定，以及这部电影究竟和片名中的上海有什么关系，因而注定就是不好的结局。,3
2019-08-12 19:22:37,蓝精灵ljl,5,这部电影为流量鲜肉关上了中国电影的大门，这比打开中国科幻大门要重要的多了。所以我要评五星。（狗头保命）,17
2019-08-10 16:26:52,焱返,2,快把我的意大利、不是，上海大炮拿来！,11
2019-08-31 18:15:22,邮差总按两次铃,2,片子确实烂，但导演意愿也确实是把片子拍好，奈何拍出来的就是个游戏CG。像个理科生交作业，只谈数字不谈情怀，跟前一阵的公式相声类似，按着几十年前的电影设定路子往里套，有刻意的战前煽情，有曾经流行的青春恋爱剧里主角的青涩忐忑，还有立个flag等战争结束就...然后死在下场战役的俗套剧情，整部看下来就像给罗杰《我知道你们又来这一套！》拍的书评注释。导演以为请个流量明星，在特技方面秀秀肌肉，将近一个小时的高科技战斗戏就能让观众潮吹了，可惜9102年抛开剧情谈特效让观众湿了都难。,1
2019-08-10 17:06:11,张,1,我是被闺蜜鹿晗的脑残粉拉去看的，唉，我能做的就是偷偷来这里打个一星！,10
2019-08-09 22:03:47,酒兒,2,客串的江南和翻唱的《世界末日》也拯救不了机甲版《小时代》的气质，给舒淇加一星吧(ｰ ｰ;),8
2019-08-09 20:02:46,光口乞不月半,2,其实也没骂的那么差，比逐梦xxx强多了，和富春xxx一个水平罢了。感觉受骗奋而一星的同志们，回忆回忆除了流浪xx之外的国产科幻片，就会宽容一点了。,2
2019-08-11 10:50:35,night,1,我为什么不听劝,9
2019-08-09 15:10:21,momo,1,这是什么科幻片? ? ?,15
