time,user,rating,comment,votes
2019-08-09 01:07:16,少年不识,1,预告片就已经够烂了…,62
2019-10-05 08:45:27,冰山的阴影,1,第一部出片名之前就把我催眠的电影。,3
2019-08-09 13:54:16,SamariumL-v-,1,Emmmm 想了半天竟然挑不出一点能夸的😂,10
2019-08-10 14:23:47,Rice,5,上海大炮出水得时候太好看了，紧凑的战斗场面，都没有时间谈情说爱，这里的两条感情线都很惨，最后歌声一起，泪奔了,13
2019-08-10 08:23:20,酷爱网上冲浪,1,全程只能用震惊这两个字。,22
2019-09-06 22:02:20,HarperYug,1,要不是周限定，可能我永远都不会碰这部电影吧。看之前很想吐槽的，但是直到看完也没说一句话，因为压根懒的吐槽，实在是太糟糕了。没有硬核的科幻、蹩脚老套的爱情故事、尴尬无聊的对白、就连嘴型全程都没有能对的上，欲哭无泪……emmm，挑一个稍微能夸的吧，舒淇好好看哦~,8
2019-08-31 22:26:15,BLACKZorro,1,我终于可以心安理得地贡献上我的一星！妈呀！我他妈的，我为什么要自讨苦吃，这破电影还能再雷一点么？妈的，还好老子没买票，这种电影就应该让它扑得连灰都不剩！不行了，我要看点别的洗眼睛去了。,3
2019-08-16 12:15:53,Erdong,1,滕华涛导演是流量鲜肉电影倒下的重要推手，为国内电影业做出了不可磨灭的贡献，历史会记住他，观众会记住他，人民会记住他。,19
2019-08-12 15:42:00,Cucuci,1,这部剧挺好的，大家去看吧，毕竟冤枉钱不能让我一个人花。,9
2019-09-14 18:56:26,筱晗,2,叙事性太差，不好意思说自己是书粉。为啥大家都想炸静安寺？我还要去拜拜呢！,1
2019-08-09 10:33:33,魔法烧酒鲁路修,1,鹿晗粉丝给同期其他电影打低分却给爱情堡垒打满分，我决定奖励这部作品一颗小星星，加油，鹿晗的路人观感就靠你们继续败坏了。,11
2019-08-08 18:05:53,电影败家子,2,想不到啊，片中三大败笔竟然轮不到鹿晗。,50
2019-09-02 21:30:14,hedgehog,1,😂,2
2019-08-09 12:10:25,Ja M,2,希望外星人能赢,31
2019-08-12 08:41:30,二二三-,1,我一星给舒淇💩💩💩,16
2019-08-11 00:28:56,德布劳外,1,从龙族手游到这个让人想骂人的电影，江南把自己过去二十年的青春全都卖了，建议蔡徐坤以后出演路明非,7
2019-08-10 14:18:31,筱郁,4,我一直对战争电影充满兴趣，这个没有让我失望,10
2019-08-29 22:51:56,第七旅,3,……刚看了，又在模仿《哈德的游戏》和《星河战队》中的桥段，还有一点点《深夜食堂》的元素……比起流浪地球算是进步了吧！距好莱坞水平还差两步……看到点希望了！最后是在致敬《董存瑞》吗！？,3
2019-08-09 13:22:13,金色阳光,1,这就不是科幻片吧，网剧特效水准吧，但还赶不上腾讯的鬼吹灯。倒不如踏踏实实作为爱情片上档，别拉流浪地球的人气，越蹭热度恶评越多。海报变成粉红色，原地转为7夕档，不至于输掉裤衩,12
2019-08-29 22:44:37,幽草沐晚晴,4,感觉没有网上说的那么差，特效挺好的。但是鹿晗演技不咋地，每次镜头看他时候，他就内心os，他说话时候，镜头不看他。什么鬼。给4星，全是给特效的。,2
2019-08-09 08:13:08,纠纠老秦,1,打着科幻旗号的百合爱情片！六毛特效，毫无逻辑只知道刷脸摆酷，脸不能花，头发不能乱，敬个礼都有气无力，外星人居然真是人形！大量抄袭独立日！,81
2019-08-13 02:38:26,抓住一只錫长安,1,2.3分      看枪版是浪费时间，去电影院看是玷污生命，珍爱生命，远离上海堡垒！,13
2019-08-10 01:17:55,☁️elahwgnissim,2,电影是真的烂，但不是烂在鹿晗身上。看得出来他是所有演员里最用心对待这部电影的，也是演得最入戏最自然的（真的），然而人们的口水都会向他喷。电影好坏的最重要标准是有没有讲好一个故事。所以这部电影的导演兼编剧，请转行，别碰科幻电影了...讲故事的能力烂到令人发指。没有一个人物形象是饱满的，所有人物关系的连接与发展都是莫名其妙的，情节中的逻辑是根本不存在的。以后这位导演的饼算是毒饼了。最后，舒淇在我这里滤镜破灭了。接烂片赚快钱不可怕，可怕的是纵容自己成为烂演员。现场碰到她路演，很想问她，觉得自己为这部电影付出的努力够吗？但怕被后排的粉丝打，算了。,6
2019-08-12 18:18:03,修齐,1,"不吹不黑,从中立的角度谈，确实,很大气,立意高,能自洽,显示了中国科幻人特有的浪漫情怀全片也时刻展现了导演对于整个故事的把控，演员对于角色的理解,尤其是在危急存亡之际闪耀出的大无畏的勇气与可歌可泣的爱情都让人泪目全片水平之高,对标好菜坞的话，与环大西洋不相上🐶1星因为手残，下次改",27
2019-08-10 08:33:51,back2future,1,大家都不敢在微博说片子烂，会被粉丝围着骂…太艰难了,35
2019-08-11 12:31:42,凤姐母仪天下,5,继《流浪地球》之后，又一国产科幻登峰巨作！《上海堡垒》对于科幻技术的使用非常到位，这毋庸置疑。导演滕华涛基本上忠于原著，关键节点都没落下，引出了对于如世界末日般的外星侵略的思考。,3
2019-08-11 10:51:18,龚言卿,1,毁灭吧，赶紧的。,11
2019-08-10 13:58:08,你微笑很美,1,"这才是中国科幻电影的常态嘛！什么小破球这种昙花一现的东西拜托就不要打扰我们恰饭啦",9
2019-08-09 14:24:23,夜羽,1,求你们了，别去花钱受罪Y(>_<、)Y,24
2019-08-04 18:18:18,一條魚佔滿了河,1,演員表現一般，但不能背鍋，鍋是導演和編劇的，科幻設定基本是20年前的，再加上三流網游的粗糙特效，整個故事被講得七零八落，愛情不動人，對戰不熱血，整部電影味如嚼蠟，睡點滿滿。光拿《流浪地球》對比，就已經顯得用心太多了，用心程度甚至不如伴手禮。,61
2019-08-14 15:58:36,委員長,1,毕导运气太差，逐梦演艺圈要是和上海堡垒同期上映，怎么也能混个四星，真是没有对比就没有伤害,8
2019-08-09 21:57:31,白桦林里阿庆嫂,1,太难看了，做错了每一件事。本来以为再难看起码可以瞅一眼人间大炮排击陆家嘴以及上海沉没的大场面，然而却连这都没有。由于就是糊弄事儿的项目，建设性的我也就没有了什么技术意见可以提，想来想去可能有一条：舒淇的角色换成林志玲、鹿晗的角色换成王宝强，这大概会使得本片的气息稍微顺畅一点，看上去像一部普通的烂片而不是后现代烂片。,7
2019-08-12 14:17:14,穿裤子的云,1,真的很烂诶，居然有人点了五星！！！！！如果你以这部电影为自豪，我真的想头给你打歪！！！这部电影真的很好的诠释了“烂片”这个词！！！,22
2019-08-13 13:57:38,Erini,1,今天爆出抄袭事件，导演你好意思说潜心5、6年的作品？？？,16
2019-08-10 17:41:15,飞侠式拼搏,1,看前你以为是战争科幻片，看时才发现是言情片，甚至有校园青春片的影子。看完你总结道：科幻不科幻，爱情不爱情，青春不青春，分明就是四不像。剧情一塌糊涂，人物单薄跟纸片一样，表演和台词满屏尴尬，不合理的地方更是多的数不过来。穿插的感情戏毫无铺垫且极其生硬。即使每场战斗后都加上感情戏，但男女主的感情却没有得到一点丰富，根本无法打动人，只会令人作呕。战争戏也只能用“乱”来形容，不激烈毫无冲击感。特效一般，某些场景更是塑料感十足，唯一还行的就是上海陆沉。外星人轻易闯入指挥中心关掉泡防御，而你告诉我人类拿手枪反击，真是令人可笑。上海大炮有轰掉外星母舰的威力，却伤不了江洋，果然主角光环才是最强大的存在。无笑点无泪点无燃点，全程只有尿点。这就是所谓的“六年匠心”“斥资三亿”？这都是拍的啥玩意啊。,7
2019-08-09 18:33:15,山下猫,2,一半。可以说没什么屁味，世界观上本来也没期望，无非是危机-解决-危机裹一层科幻外皮。但是美术上审美就很落后，不是未来不未来，就是丑。机器人入侵打肉身，前面说上海多牛是吹彩虹屁喽？角色都像是装模作样地在打仗，价值观上也没有期望，毕竟滕华涛的电影都是电视剧式的安全主流。没期望结果全中。我回头给昨天的邱礼涛加一星好了,11
2019-08-09 12:14:18,没事打豆豆^_^,1,买票时抱着侥幸心理，也许这片子可以看看特效。当看完后从电影院出来时真想剁手，手贱买这个电影！,9
2019-08-11 10:32:09,Cynthia,1,简直烂出天际。导演还有脸在微博喊努力了没回报，你努力拍了这么部烂片你还想要啥回报！！,13
2019-08-31 01:04:11,土耳其大骗子,1,我…实在不知道该说什么了…我太难了，我居然把这部片子一分不差的看完了,2
2022-04-03 13:54:59,Clint,1,彼时彼刻，恰如此时此刻，上海堡垒！魔幻现实主义大电影！,10
2020-01-29 17:21:17,一段流浪哀伤,2,期待是拍成跟原著风格一样的软科幻，硬言情。其实这样软科幻就挺好的，也会很有市场。别被流浪地球的成功给忽悠瘸了，好好拍科幻世界观下的言情片就很好。百花齐放。,0
2022-02-01 10:50:43,月满似时,1,还好在央六穿插着广告看，不然得把早上吃的饺子呕出来,4
2019-11-09 08:24:12,小董,3,网评一致认为是烂片，看了大半感觉一般般，没有网评的那么烂，最后几分钟的处理，硬生生的把科幻片排成了爱情片，所谓的彩蛋告诉大家，他们是彼此喜欢的，咳，真是又给本片减分。,1
2019-08-10 07:20:27,姮Joyce,1,一星送给台风天冒着大风大雨去看这部片的自己，我被自己感动了。,26
2019-08-14 03:35:09,静夜思,5,给鹿晗的颜值五份,7
2019-08-09 13:09:46,TMore,1,流浪地球：他改变了中国科幻上海堡垒：他又改了回去,43
2019-08-13 03:01:52,粗人,1,垃圾，让我讲剧情我是讲不出来的，因为中途离场。老实说这是我这些年来在电影院看过最垃圾的东西，为什么不说最垃圾的电影，这特么连电影两字都配不上。开场看到演员说话声音嘴型都对不上瞬间出戏，舒淇一出场说话更是让我产生一股想把鞋砸过去的冲动。剧情仅就我看的一半来讲实在是无力诉说了，讲的啥我全忘了，脑海自动屏蔽电影各种糟糕的场景，各种糟糕的场景调度，烂片小时代我都没有去电影院贡献票房，后续网络资源看了一半对我而言整场戏只是无趣的撕逼，而这不烂片我还不信邪的花了五十几块钱去电影院里看各种糟糕的表演，恶心的做作，网游级别特效，我简直有眼无珠啊！后悔死了，导演还我血汗钱！鹿晗求你别再演本该让硬汉出演的角色了！天生娘气不是错，挑角色请对号入座，把不适合自己的留给更适合的人。我这次算是在心里留下了难以抹去的阴影,16
2019-08-11 10:27:20,一树梨花压海棠,1,被一个脑残粉妹妹拉着去看了4D版，要不是看在她替我掏了票钱我看都不会看如果说《流浪地球》打开了中国科幻片的大门，那这部片就是关上了大门，鹿晗的粉丝还给上了把锁,21
2019-08-11 11:18:59,Louhwz,1,音乐＋1，特效＋1，依依＋1，编剧就是一坨屎，完全没有末世的感觉，导演能力hold不住这种大场面，台词讲的太差，情感推进就是跳跃式，完全无法产生共鸣，跟前面的比起来，鹿晗的问题倒是小问题了，这种烂片不死天理难容，不会拍电影就滚呐，我有罪，居然还贡献了票房。,6
2019-08-12 07:26:08,maaaaaa,1,是个高端同人视频,9
2019-08-15 12:43:58,深海,1,舒淇演三级片的时候，鹿晗还不知道在哪里呢……,15
2019-08-09 22:36:51,孔府小鱼,2,我看的时候打哈欠流的泪，就是我买电影票时脑子里进的水。,2
2019-08-11 11:36:17,之乎者也,1,这种电影都死绝了中国电影才有希望,20
2019-08-04 20:49:01,可乐,2,江南原著就是个披着科幻皮的爱情小说，电影改编成科幻向导致节奏很糟糕，完全没重点看着很累，也削减了结尾的力度，充满白眼的一百分钟。,33
2019-08-09 18:49:30,忧郁的玻色子,2,开场第23分钟，我忍不住掏出手机，把流浪地球从四星改到五星。导演神级发挥，真·你上你也行。特效其实凑合，但是和布景之间违和感太严重，于是唯一有可能及格的部分也不及格。,6
2019-08-11 09:45:22,不辨朝暮晨昏，,1,一星我都嫌多，我四岁的外甥做错事的演技都比里面的演员演技好，一个当兵的，长发飘飘，小脸白净，尼玛打外星人生死存亡之际还能摆造型，闪瞎了我的24K氪金镶钻狗眼。,10
2019-08-12 13:47:16,狼狼Ago,2,昨天看了，不吹不黑，从中立的角度谈，确实，很大气，立意高，能自洽，显示了中国科幻人特有的浪漫情怀全片也时刻展现了导演对于整个故事的把控，演员对于角色的理解，尤其是在危急存亡之际闪耀出的大无畏的勇气与可歌可泣的爱情都让人泪目全片水平之高，对标好菜坞的话，与环大西洋不相上下。,11
2019-08-10 21:40:01,riverpassing,1,从《九州缥缈录》到《上海堡垒》，江南成功转型，点赞。,7
2019-08-16 21:04:48,牛皮糖糖,1,我都不好意思跟别人说我看过,10
2019-08-09 13:25:24,一一三三,1,唱歌就好好唱，演什么戏。演戏就从跑龙套开始演，一步一步来，慢慢积累经验，你倒好一上来就演主角，一点自知之明都没有。,19
2019-08-10 02:35:14,Grislee,1,花钱看这 我是傻逼,23
2019-08-09 15:11:28,Silhouette,1,特效跟闹着玩一样，这是科幻片还是披着科幻外衣的爱情片。,6
2019-08-29 22:42:35,黎甘,3,最可笑的就 ，没有看过就群嘲，从制作来看绝不是来骗钱的。但是确实无法回避剧作上的大问题，项目从源头上就不行，后面费多大劲都不行。演员的表演，依依完成度最高。是我小时候看的迪迦奥特曼的翻拍版～,3
2019-08-12 19:52:09,凝清映画,1,这个电影好！它好就好在。。。我睡的很香,6
2019-08-10 14:11:57,小柯,3,emmmmm，看过原作，对于电影感情部分的改编确实不喜欢，少了它原本的味道，不能说出口的爱被直白的表达了，也少了1800万人中，找不到林澜的遗憾，丢了原来你也不知道的悲伤。当然德尔塔文明的展现，说实话打斗挺尴尬的。总体感觉就是很一般那种，有点不伦不类吧，但是感觉不至于低成这样吧😂，5-6之间差不多吧,4
2019-08-12 10:12:07,小鱼,1,跑进电影院躲雨看了这电影 确实是真烂啊 打着科幻片的名头结果这是个啥？？？？,12
2019-08-09 10:57:30,加油阿尤,1,希望这部电影能成为流量艺人的终结还有，请把科幻的标签去掉谢谢,18
2019-08-11 16:15:35,风起,1,我没看过，也不会去吃屎。就来跟风踩一脚，也算为中国电影行业做贡献了。哈哈哈哈,10
2019-08-10 12:21:36,梵奈不耐烦,1,我睡着之前走了一半的人,6
2019-08-09 16:25:33,小宋鼠,1,专门为毁科幻片拍的？,31
2019-08-09 12:58:28,麦克阿里,1,流浪地球打开的中国科幻新篇章，又被上海堡垒翻回去了。,8
2019-08-11 07:33:18,谁弱谁强,1,强烈抗议豆瓣评分！不公平，不客观！这么个大投资的电影怎么能给一星呢？！怎么能呢！强烈推出负分。,25
2019-08-10 12:25:20,goaway,1,沙比烂片，本来我对鹿晗和舒淇的双女主拉拉戏还是挺感兴趣的，结果没想到竟然这么倒胃口。,13
2019-08-10 16:40:40,我可能是个演员,1,看哭了，难看哭了。全片主角东方明珠至始至终都屹立不倒，如同国产科幻烂片的旗帜一般永远坚挺的勃起在这个世界上。,32
2019-08-15 11:32:26,🔥DON'TWORRY,0,总感觉这部片子少了一个人 应该是黄晓明吧,8
2019-08-13 20:58:23,青铜猫,1,这是我在电影院，唯一中途离场的电影。,13
2019-08-09 17:44:30,Jader.,1,我其实不太想承认自己看过这部电影……,49
2019-08-09 12:55:31,我在绝情谷底,1,要想高票房，请在编剧剧情和硬实力下手，中国观众人傻钱多盲目追星的时代已经渐行渐远！不是好作品就应该没有好票房,7
2019-08-11 08:23:59,SELVEN,1,10/100 号称是科幻电影，却没有任何称得上科幻作品里核心价值“想象力”的东西。当然本片失败之处还轮不到科幻先来来背锅，首先故事就是一个极其懒散不及格的作品，改编剧本届的耻辱。,8
2019-08-13 16:54:47,momo,1,鹿晗粉丝不要垂死挣扎了，好吗？要是真爱你家主子，多买几张电影票支持一下票房，别整天在网上控评了昂。,21
2019-08-11 11:54:25,Lucifer,1,呵呵,6
2019-08-16 22:45:52,凌家公子,2,听说盗版商在电影院里录电影，录了30分钟，录不下去走人了。。。,2
2019-08-09 14:46:31,白胖饺子,1,不愧是国产影视业坑蒙拐骗集大成者,7
2019-08-09 15:05:34,Lee.,1,只看出来了主演和导演对圈钱的渴望有多么强烈。,41
2019-08-09 12:44:55,莞尔的笑,1,剧情是挺灾难的，一星给舒淇…,39
2019-08-09 22:08:54,青山羊先生,1,1.“我想考电影学院！”2.“向我开炮！”3.作为爱情片，为了追求全世界最后的一座堡垒的司令官，只会发短信：好好睡，晚安4.作为战争片，除了玩金山打字式的小游戏，biubiubiu！还会啥？5.作为科幻片，不想多说啥，就一句：都2019年了，大哥！6.再说一句：都2019了！,18
2019-08-09 20:13:06,吃菜不吃呱,1,为什么按电梯等个人就是双箭头的爱？这么说的话，我是有多爱我的同事和邻居？,18
2019-08-14 11:10:45,Harry,1,大家快看，鹿娘娘穿着军装来走秀了！,18
2019-08-13 12:17:04,小猫儿花花,1,都tm跟你说了多少遍别用流量小生。,17
2019-08-11 19:07:02,22infinite,1,一个值得思考的问题，到底是先有的烂片，还是先有的烂演员,11
2019-08-13 12:27:56,张大亨,0,压力大的人可以去看看，难得的睡眠时间,10
2019-08-31 11:16:20,一只Tomason,1,质量确实一星，不能再多了，但实过于沙雕快乐不由得推荐大家都去看看。。。。我看得入迷地铁都坐过站了。。。,3
2019-09-24 11:33:30,MR.Charles,1,和朋友大周一猎奇之旅,1
2019-08-09 13:56:19,归戾,1,一颗星都不想给 军人就应该有军人的样子。鹿晗真的 当歌手就好好当 歌也唱不特别好 又天天跑去演戏 偶尔演一下也行叭 再好的剧本都给你搞没了。配戏挺好的演员。。,7
2019-09-11 12:39:56,pumpkinbrain,3,没有这么差吧，原著本来就是软科幻，偏向故事和气氛，改成电影这种需要大量技术细节的东西，本身需要填充的东西就太多了。而且估计编剧也没几个懂的。拿这个和大刘比，也太苛刻了。拿过雨果奖的硬科幻作家和小言奇幻作家的区别还是大的。但是基于小说，电影最大的硬伤是把视角变成了上帝视角，出现最多的镜头就是空中俯瞰，导致故事完全没了人情味。原本软科幻的叙事优势荡然无存，故事没有根，科技又不过关，只能强行抒情，尴尬的一比。。,1
2019-08-09 14:00:31,麦冬YDango,3,评分从3.9到3.6只用了2小时哈哈哈简直魔幻。大概是因为抱着1星的期待去看的，实际观感没那么差，但也确实很中规中矩。剧情逻辑有点强行，不明白为什么很多人在这部立项的时候会对作者本人编剧有信心，他原著也很不大气很一般啊，从剧本上就注定它不算是好电影了。另外，旁白过多可以算是导演和编剧没有能力通过电影手法展现所需内容的一大共识了吧？这里【所有】年轻演员的演技都不足以撑起这部电影，包括舒淇的台词。所有曾经从流量中获取的红利，终将会被流量反噬，也是件好事。,11
2019-08-09 20:35:18,祝六一,2,56/1、后期配音也就算了，能不能声音和口型对上，这是后期问题还是演员台词问题?       2、剧情问题，地球防卫军就这点战斗力?靠突击步枪和敌人拼?还有指挥部和指挥中心那么重要的地方，就这么让外星人进来了?未来科技这么落后?城管大队都比你们强。       3、主角光环太严重，“向我开炮”母舰都炸没了，主角在上面竟然没死??你以为自己是钢铁侠?       4、情感这条线真的很尬， 尬出天际。       5、中国科幻电影靠流浪地球打开了一扇大门，而现在上海堡垒成功的将其关上。        6、中国科幻电影，卒，享年一岁。            （2019.02.05～2019.08.09）,15
2019-08-09 16:45:36,是舵不是坨,1,观影期间一度恍惚我看的是个啥电影🎬,22
2019-09-03 00:53:03,su27根本就没有,1,不知道说什么了，如鲠在喉又吐不出来的感觉。对不起我的时间。,3
2019-08-09 06:41:14,伏笔,1,这简直就是一场灾难，去了提前观影会，导演看起来就是个铁憨憨，鹿晗依旧花瓶，座位上的韭菜们疯狂呐喊，快来收割我吧！,80
2019-08-10 16:24:36,游进露露的鱼塘,5,忘记是哪位导演曾这样评价鹿晗:少年是荧屏难遇的光。加油，鹿晗💪,18
2019-08-09 15:21:59,.Leon.,1,守护我们最好的晗晗，一星鼓励哦~,19
2021-01-09 15:33:15,小粉,5,大家一定要看，一定要配合弹幕看！！！！！！！！！！！！简直承包我一年的笑点，哈哈哈哈哈哈哈哈哈哈哈哈哈哈,5
2019-08-11 01:20:34,沙漠中的西蒙,1,这还好意思出来营销微博评分热点吗？就好比脸红脖子粗的说，我在屎里还是比较新鲜的。。。,23
2019-08-10 13:09:10,堃岩,1,我觉得应该加一个新分类，叫灾难片😂各个方面来说都是灾难,22
2019-09-03 00:52:05,孤挺红碧大狻猊,1,在腾讯上看过了。怎么说呢，我这么多年都不抽烟，看完以后都想去天台抽烟了。一整部电影毫无高潮，外星人没有露过脸，大段旁白和鹿晗内心os，以及两个人一起吃了一顿面舒淇还要早走...两个人坐得超级远，还没有给面特写...好歹让我们看看上海劫后余生成为唯一堡垒的时代那碗面到底是北方面还是苏式面啊！,4
2019-08-11 05:35:00,🍊🌶️🌶️,1,逻辑bug太多了,11
2019-08-12 08:46:54,张小重同学,1,看剧照就知道很烂！军人没有一点军人的形象，拜托鹿晗可别再去演什么军人硬汉形象了好吗！眼都要瞎掉了，花瓶适合你，这位出道9年的新人,23
2019-08-10 18:20:37,限定,1,作为一部烂片，它很好地提供了大量的吐槽素材，是烂片之鉴,9
2019-08-09 10:47:29,三千路途锐利,1,看了这部电影我大概瞎了,25
2019-08-13 07:13:21,灵,1,鹿晗现在的人设就是烂片演技差，许多人不看就给了1⭐，再加上众多脑残粉的支持，更加快了1⭐的节奏，去电影院不知道看啥，哪吒评分再高也对动画没啥兴趣，于是看了这个，嗯，这评分这么低也是有道理的，鹿晗还是乖乖做音乐吧，额。。。鹿晗有哪首脍炙人口的歌曲？还真不知道。。。还是乖乖做流量艺人吧，演戏啥的别沾了，其他不说了，军人长发形象一出来，就配得上这1⭐了，相比之下，觉得同样类型的张艺兴就好多了，至少给我印象深刻的有二月红和一出好戏中的出彩表现，人设可以靠自己努力去改变，,15
2019-08-11 11:18:26,momo,1,电影刚开始十分钟我以为这是部科幻巨制，二十分钟的时候我感觉可能是个剧情片，三十分钟左右判断了这是个偶像爱情片，四十分钟以为是在看冗长的电视剧，最后的十分钟里我悟出这是鹿晗的个人发型秀，也是苦了做了好几个造型连做军人都不忘留刘海（可能比头盔重要）的tony老师了！,13
2019-08-09 14:19:13,周广立,1,真有诚意就不会找什么鹿晗了，若此片成功，中国电影必亡。一个不会演戏的鲜肉，一个拍电影《爸爸去哪了》的导演，此片不烂对不起牛顿爱因斯坦,17
2019-08-10 12:59:43,wait1ess,1,军人刘海？选角就已经出问题了！,21
2019-08-14 01:58:24,qazwsx,1,9 Aug 2019。很久沒有沒看完 甚至沒看到1/3就離場的爛片了 （連波波奶茶都挽救不了想走的心）蒼天 怎麼會有這麼尷尬這麼矯情這麼多bug還硬插動作的編劇......舒淇女神是走錯片場了吧。,14
2019-08-09 17:36:51,夸我帅不行吗,1,有谁知道鹿晗的发胶啥牌子，那么激烈的打斗 头发都不乱,38
