time,user,rating,comment,votes
2019-08-08 18:00:05,郊外的耶稣,2,头发这么长，有没有一点军人的样子！,21546
2019-08-08 21:57:00,西楼尘,1,如果故事不是发生在陆家嘴而是在象牙山，江洋暗恋林澜就像王长贵喜欢谢大脚，这背景除了土一点并不违和。与其搞什么德尔塔母舰，还不如拍个未来版乡村爱情。能守护上海堡垒的，不是韩国做的泡防御，不是美国产的无人机，不是黄浦江里冒出来的上海大炮，而是中国电影人把真诚的心，放进钛合金的盒子里。,16941
2019-08-09 00:36:18,淋,1,科幻片来说，它基本上是把中国科幻能犯的错误都集齐了；要说爱情片，它倒是有连七夕档都不敢上的自知之明,16323
2019-08-09 00:02:08,九宸,1,毫无逻辑的剧情，生硬尴尬的表演，这是一部很标准的烂片,17658
2019-08-09 13:02:53,朝暮雪,1,中国首部三角恋科幻片，披着科幻外壳的言情剧，这是科幻片被黑得最惨的一次。打外星人只是表象，本质仍然是霸道女总裁爱上我。都世界末日了，男主角还可以休假，还忙着谈情说爱，上战场前最后一件事竟然是给司令官表白。这都什么年代了，他还发短信，而且短信还发送失败了。还有面馆、宿舍、汽车、电脑……通通是现代的科技水平。外星人入侵地球，上海竟然成了唯一的希望，完全不交代其它国家在干嘛。而灰鹰小队，则是上海的唯一希望。复仇者联盟打个灭霸还要几十个超级英雄，本片拯救全世界的重任就交给三个年轻人，你们比钢铁侠还厉害啊。江洋作为军人把头发留那么长，严重有辱中国军人的形象。你确定你是来打仗的？你是来选秀的吧。如果说《流浪地球》是为中国科幻打开了一扇门，那《上海堡垒》就是关上了这扇门，还用门狠狠地夹你的脑袋。,12766
2019-08-09 00:01:33,艮艮,1,披着言情皮的科幻片，剧情毫无章法，鹿晗演技好差。,13479
2019-08-08 21:07:44,后自愈,1,科幻片：请不要装熟谢谢。披着科幻片的皮拍爱情，纯属蹭热度。今年不是说科幻元年吗？怕不是要被《上海堡垒》搞成绝唱。,11676
2019-08-05 10:17:58,GA,2,韩国班底的特效缺陷很明显 本就是个情窦初开的故事 硬要配一个扁平毫无说服力的末世世界观 小分队还不如中国特供环太平洋,5337
2019-08-09 00:04:27,阿珂,2,《流浪地球》让我们看到了中国科幻片的希望，《上海堡垒》让我们看到了对圈钱的渴望,3812
2019-08-08 11:44:11,Reaper,1,《上海堡垒》06版作为我最喜欢的小说，影响了我十多年。我无数次想过如果这部小说拍成电影是什么样子，然而当看了本片之后，我宁愿这电影从立项时就胎死腹中。看了这样的垃圾，只想给流浪地球道歉。,11286
2019-08-09 09:08:39,王大虾,2,打仗那么久了，鹿晗的脸上还是那么白白的干净。化妆师扣三星。,1917
2019-08-06 18:06:27,書崎,2,这不就是真人版微信小游戏“打飞机”么？？？,2781
2019-08-09 00:10:07,灌水机,2,2.5 当个战争爱情片看就b事没有了。如果想看灾难科幻，我为啥不直接看独立日？要看你在这喊向我开炮？,1075
2019-08-09 13:15:18,咬一口好不好,1,流浪地球:翻开了中国科幻的新篇章上海堡垒:翻nm，把书给老子合上,9146
2019-08-09 00:16:37,你才是吹风机,1,建议改名叫  上海甜蜜之暴击外星人    这样比较符合这部烂片,6548
2019-08-09 00:10:11,一只猫,1,影院出来的过来人劝大家都别过来，看盗版都觉得浪费时间的片。看到这么多人骂我就放心了,7434
2019-08-04 23:06:57,华盛顿樱桃树,1,除了特效，一无所有。也可以说除了特效，其它还有啥？咣咣咣了两个小时，科幻片的精神内核可不是这样的。别跟我那条毫无感觉的感情线，无法令人信服。,6317
2019-08-09 10:52:25,傲娇的喵小姐,1,被一个朋友拉去看的，她请客。全程我都在玩手机，实在看不下去。剧本太烂，谁也救不了。影帝来也一样吧！,5452
2019-08-09 15:06:10,桃桃林林,1,如果说科幻只是背景，主打爱情的话，为什么爱情部分也都很突兀且硬来呢？另外，滕华涛导演感觉完全不会拍动作戏和战争戏，动作场面也太乱来了，也难得见到打得这么不紧张不激烈不好看乱糟糟的。以及，除了两位主角表演一般之外，所有配角的表现也都很差，所以，选择他们出演的目的又是什么呢？,2305
2019-08-09 20:17:50,亵渎电影,1,这些电视剧老导演不仅对科幻电影有误解，对类型片有误解，对电影是什么也有深深的误解，奉劝这些电视剧导演还是安心拍电视剧吧。《上海堡垒》是一部标准的烂片，电视剧思维的产物，所有叙事逻辑和戏剧冲突都是想当然，一分钟不用廉价的抒情配乐就会死，反派无逻辑，特效无细节，叙事无节奏，也没有科幻世界观的构建，还处于编剧瞎JB写，导演行活瞎JB拍的阶段。《流浪地球》的成功仅属于郭帆导演和他的团队，暂时还是小概率事件，对中国电影工业和中国科幻电影的影响目前真没看出来，如果大家是对中国科幻电影有什么期待的话，还是散了吧。0分,815
2019-08-16 18:26:30,张小北,2,这个电影很糟糕，也引发了群嘲。但对于严肃的科幻电影爱好者来说，我们应该从中去学习而不仅仅只是嘲笑。巨大的失败背后也隐藏着不可忽视的经验，而且这些经验更加重要，因为巨大的成功可能会掩盖错误。巨大的失败之后，我们更需要冷静客观理性地总结经验。中国科幻电影不是一部电影能开启的，也不是一部电影能毁灭的。,138
2019-08-09 11:08:18,曾于里,1,鹿晗的时代彻底终结，希望以后彻底不要在大银幕上看到他,3221
2019-08-09 09:14:06,hdoom,1,这是我唯一一部希望外星人👽赢的电影,2998
2019-08-04 16:13:00,小心和小欣,1,舒淇有多好看，上海堡垒就有多烂。,3024
2019-08-05 05:26:12,劈叉浣熊,1,这颗星给特效公司，辛苦了。一部完完全全的骗钱作品，剧本写得是堆屎，导演技巧是堆屎，概念设计是堆屎。这一大堆屎还憋了六年，如果不是为了搏同情，我只能说这水平趁早别碰科幻片好吧？江南这个水平赶紧告别文字工作吧，会写小说不代表会写剧本，一个戏剧动作都没有，全靠旁白对话带信息你敢信？滕华涛也请拍自己擅长的都市情感电视剧吧，《蜗居》《裸婚》拍挺好的您何必？还“第一部”“科幻爱情战争片”，我可去您祖母的吧，类型不是您这么玩儿的，类型融合没您这么屎拌屎的，求求大家严肃点儿对待电影，好么？,2704
2019-08-08 11:06:26,韦斯安徒生,1,这哪是末日之战，分明是玩具打架，科幻感不是塑料感和特摄感啊！文戏基本全废，台词小学生审美。动作戏对剧情推进毫无帮助，设计感为零，除了爆炸就是人海战术，没有紧张感可言。某鲜肉演军人都放不下沉重的偶像包袱，任什么情形造型都绝不会乱，以帅为本。另外，都什么年头了，后期配音还能句句对不上嘴型，草台班子水准。,1435
2019-08-09 12:24:55,凉非,1,真的是...一颗星都不想给如果你支持中国电影 支持中国科幻 哪怕是让这个世界变得更好一点的吧 答应我 不买票 不讨论 不参与任何话题 一分热度都不要给他 自生自灭去吧,2089
2019-08-09 15:07:37,王大根,1,确实是你能想象到的最烂的科幻战争片了，未来城市就是实拍了一堆上海高楼（并且拍得灰头土脸非常丑），再往上面P点三维影像、荧光屏幕，看起来特别廉价。外星人基本就是机器人，没有任何外星感；全球防御指挥部总共不到十个人，总之就是“外星人侵略地球，上海是地球最后的堡垒”这个最最最基础的设定都没能建立起来。主角从头到尾零性格零成长，根本没有任何存在的必要，最要命的是片尾曲还给我翻唱周杰伦的《世界末日》……在世界末日和这部电影之间我选世界末日啦！,1101
2019-08-09 12:15:05,思路乐,1,【D】说一个很有意思的点吧:鹿晗是主角没错，可很奇怪的是，每次只要有他的戏份，镜头大多都是远景或中景，很少去把镜头拉近对准演员的脸。我想，这是不是也代表着主创自己心里也有数呢？当然，就算是近景特写，演员当时所传达的感情大多也是正常的“平（si）静（ma）脸”，唯二两次大幅度的情感波动，只能说是惨不忍睹。为了凸显出主角的情感表达，本片大部分用的竟然还是鹿晗的旁白。你们可以去想象一下那种临场感受，简直绝了....,826
2019-08-09 08:22:20,月色归来时,2,56/100 口碑扑街一直是意料中的事，看了预告片更确信了，但还是忍不住去看了首映，就这水平宣发还一直拿来跟《流浪地球》比，我看五分之一都不及……,736
2019-08-09 10:52:21,看过,1,震惊！一90后男子狂追70后女生，为此入伍却一无所获,863
2019-08-10 01:19:03,Good JOB,1,希望观众明白，抵制烂片也是对国产电影的支持,522
2019-08-09 08:52:01,黄悦_,2,其实特效还不错啦,148
2019-08-09 00:11:23,fly,2,之前Social需要先看了。如果出现拿独立日吹这个片子的真是伪科幻迷的典型，独立日是什么年代的片子了？20多年过去了啊。就因为这片子有抄独立日的镜头，学了打打打的老套路，就被利用着拿来吹已经2019年的中国科幻特效？给我们一些真正的新东西可以吗…当然肯定有人说两框这本来就是伪科幻结局愚蠢的言情小说。那电影言情方面的处理更有得吐槽了。情节和选人在我这里都是失败的，入不了戏，无聊。演员没演技的居然依赖旁白表意和时而对不上口型的配音。总之，科幻和言情哪方面都不满意，不考虑social效应的话无疑浪费了我时间。 为了一部无聊的影片不惜污染我的观影list写个点评算是偶发善心为了提醒和我一样对电影有一定要求的人。 唉，其实也很想和其他人一样不多说直接一星总结算了，毕竟这片子吐槽都不值得费笔墨。,232
2019-08-08 14:05:08,老同志🚲远去,1,爱情台风，管他北南西东----顺义二院,2244
2019-08-09 12:38:55,天启五城治防司首席巡捕,1,从九州缥缈录到上海堡垒，完全证明了江南作为公司老板之一和编剧，只希望尽快消费自己的作品，赚取最大的经济利益。连自己亲手写出的作品都不重视，就不要怪市场教他做人了,1148
2019-08-09 12:20:20,黍离,1,劝大家别浪费钱去电影院了……,708
2019-08-09 10:33:08,夏多先生,1,从某种程度来说，这部电影还是有划时代的意义的，它象征着粉丝向的鲜肉担当电影末日的到来。资方在这部电影以后应该也明白了，拉一些小鲜肉（其实说实话，年近三旬的鹿晗已经不能算小鲜肉了吧，最近的照片各种油腻，为什么粉丝还总是叫他少年少年的？不害羞吗）来出演电影就想骗一波钱的烂片时代已经过去了，以后能打票房的只能是在质量上过硬，遇火炼真章的那种，作为一个时代的完结，《上海堡垒》还是值得被人铭记的。,678
2019-08-05 10:55:24,Miss劉媛,4,特效不错，在国内科幻里面，也是走在前端的，主要以战争为主，鹿晗和舒淇小姐姐的感情戏不多，刚刚好，看到“收到”那个短信时的略微遗憾和感慨，以及最后舒淇回头之后的笑，非常甜~,1228
2019-08-04 18:22:39,豆瓣路人己,2,科幻片是想象力的艺术品，但是在这里，看不到任何想象力，所有的设定都是矛盾的，像一盘散沙。里面的演员都是灾难，尤其是那位归国鲜肉。,320
2019-08-04 15:17:59,文文周,2,实力这么悬殊的仗咱能不打吗？,66
2019-08-09 16:48:04,镜城城城城,2,虽然上映前嘴上说着不看，但最后还是去看了…… 我给打两星，都算是拉高上海堡垒评分了😂 鹿晗同学，答应我，好好唱歌，别再去祸祸电影电视剧好吗？！,67
2019-07-30 21:29:58,朝阳区妻夫木聪,1,强忍着前面的九十多分钟撑下来没想到还是没躲过片尾曲带来的重击，求放过我们家杰伦吧谢谢您嘞。,1179
2019-08-09 14:03:04,子戈,2,用上海大炮来一发后，男孩成长为男人。,63
2019-08-09 13:31:17,二月鸟语,1,毋庸置疑，《上海堡垒》是部烂片！虽然没达到全方位烂，但已经很接近了。他的问题在于剧本（人物、情节、冲突等等）不讲逻辑，放飞自我。特效和形式跟《变形金刚》都没可比性，更别说《星球大战》了。演员全员面瘫式表演也非常尴尬，当然并不是说鹿晗、舒淇演技差，要怪只能怪片子角色差。都说今年是中国科幻元年，我觉得这部片子可能是来蹭科幻元年的热点来了。因为作为科幻元年的第二部科幻片，烂成这样，必然是对中国科幻的一次信心打击，中国科幻其实也蛮努力的，但优质资源和资本都被一群不懂科幻的人占用的时候，是不是特别上火？回头看，才发现《流浪地球》真的不容易。我们的电影市场已经不是前几年烂片随便五六亿的时代了，来玩票的确实应该好好思考一下了。,537
2019-12-21 00:38:19,影志,1,今年最后悔和失误的一个决定，是在公众号推了这部电影。,142
2019-08-09 12:35:11,杨多荤,1,2019年在影院里最为煎熬的一个多小时……叫啥上海堡垒？叫上海屯还差不多,654
2019-08-07 19:22:45,五彩缤纷的小丑,5,4.8/5。和原著比，这部片子有改动，路依依不爱江洋了，好好睡晚安的细节也有调整。但整体而言，这依然是一部非常用心非常有质感的电影。先说总体，战争线和剧情线导演平衡得很好。科幻我不懂，我平时更偏好言情线，电影里，少年人半仰慕半暗恋的情绪表达得非常到位，渺小和求而不得也处理得很好，可以说，《上海堡垒》原著的精髓，电影是抓到了。再说演员，舒淇美得像琉璃，指挥官的坚强和女性的脆弱融合在一起，非常有魅力。鹿晗把少年暗恋这种感觉演到位了，他的表演是整部电影的一个亮点。,4835
2019-08-04 22:59:48,Margo,4,末世感不错 技术OK,1002
2019-10-05 13:48:12,同志亦凡人中文站,1,Netflix的大数据太厉害了，知道我最近喜欢看烂片下饭，就全给我推荐这种~~~~~,84
2019-08-09 02:23:41,阿彬同学,1,从一系列的宣传动作和电影质量形成的巨大落差来看，影方和主演是典型的当了婊子还想立牌坊，还好尽管无耻无畏的波涛是怎样汹涌，清醒的仍是大多数,768
2019-08-09 10:53:17,LST,1,真的是”灾难”片....大家别踩这个雷,577
2019-08-09 00:35:49,后方童鞋,1,至今都还有很多制作方和投资方不断用事实证明通过流量明星带货是行不通的，只是可惜了舒淇。,600
2019-08-09 10:32:35,言午夢,1,卧槽这是诈骗来着吧，打着科幻片的预告和宣传你tm给我看的是爱情动作片？这是偶像电视剧吗？剧情很尴尬！特效马马虎虎，服道化很尴尬 ，换皮青春爱情片 ，绑定《流浪地球》宣传，粉丝尬吹情怀 ，军人留长发，帽子朝天带 ，剧情无逻辑，强行领盒饭 ，虚假宣传，强行家国情怀 ，终极尬点：台词那都不是事，配音口型12345 垃圾电影,593
2019-08-09 13:41:56,多吃水果身体好,1,真的是玩脱了，这片子跟科幻有关系么？不断的重复母舰回来了母舰又走了，节奏无比缓慢，表演极其没有紧张感，这个电影鹿晗还真就不怎么背锅，谁演都一样改变不了电影太差劲的本质！东方明珠在这么多次交战中一点损伤没有，莫非外星人也有保留文化遗产的意识？忍住四五次没有退场是我对这个电影最大的尊重。,382
2019-08-09 01:41:45,虚构天堂,1,如果说流浪地球是中国科幻电影的探路者，那上海堡垒只是个蹭热度的投机商，货车旁边的哄抢者。,1330
2019-08-04 19:13:36,但丁的方舟,1,画面、特效和上海沉没能看、可喜。除此之外这是坨什么混搭发馊的屎，千疮百孔，详细吐槽都觉得浪费时间的那种。强烈怀疑是不是《流浪地球》在前，压力让项目经过了调整。科幻部分和爱情部分完全不搭，互拖后腿互衬得更烂。前者如同儿戏处处逻辑不通，后者莫名其妙生拉硬扯。剧本也就青少年小说水平，推剧情全靠旁白，战斗布置全靠嘴，有个锤子世界观，结尾还敢玩闪回。选角真灾难，台词真灾难。不标榜自己是“科幻战争大片”还好点，完全不是一条路子蹭个什么劲。不过片方大概也为难，带了这标签拍个青春言情片可能更不会被买账吧。,1748
2019-08-09 01:46:12,夢、終會醒,1,？？？最后打母舰那里，怎么那么扯淡，上海大炮由于被损坏了，然后就无法锁定外星人母舰，竟然还能被动锁定了鹿晗的战斗机，然后鹿晗驾驶着战斗机冲向母舰，最主要是母舰旁边都是外星人的战斗机，以上海大炮的威力，还有那么多外星人围着，然后鹿晗竟然没有死，被弹射出去了，这还能再扯淡一点吗？上海大炮那么大的威力都搞不死鹿晗，这主角光环也太牛逼了吧？？？？？？,1216
2019-08-04 20:39:40,Cheeky Monkey,3,看完电影第一感觉，鹿晗唱歌真不错！真的！多唱歌吧！,9950
2019-08-08 17:48:40,少年面条,1,如果说《流浪地球》是开启了中国科幻大片的鼻祖，那半年后《上海堡垒》就成了终结中国科幻大片的罪魁祸首。,1564
2019-08-19 08:51:23,李厂长账号装修,1,听说有个做盗版的，录这个三十分钟受不了就走了,119
2019-08-09 00:27:01,apple,1,剧情乏味，不是靠故事细节和逻辑推动的，严重依赖旁白和粗糙别扭的台词。特效和配乐的品味都很低。对，重点强调是品味问题。不管拍得多烂这种题材找鹿晗来当男主角依旧算是暴殄天物，舒淇也完全不适合林这个角色。一直没有热血紧张感最后算是给这人拍了个MV…………,527
2019-08-09 10:46:26,鸡米花,1,球球别再捆绑流浪地球营销国产科幻片了，本质就是披着科幻外皮的圈钱言情片，鹿晗演技还是一如既往的烂，心疼舒淇为了还人情接这么一部二番烂片。,379
2019-08-09 14:42:13,花猜,1,《上海堡垒》给中国的科幻元年画上了句号。,314
2019-08-09 10:28:31,小狗勾,1,如果说没有先看流浪地球的话可以给这个剧3分，但是看了之后只能给这个电影1分了，差的不是一点半点了，对比太强烈。,398
2019-08-09 10:53:07,vincent,1,看了首映，剧情尴尬，戏剧冲突刻意。演员表演很尬，剧情完全侮辱观众智商。外星物质叫仙藤。长成紫水晶的样子。呵呵。上海被毁之后，居然眨眼间就能重建好。城市还和毁灭前一毛一样。真是厉害了。全程手枪啪啪啪打怪兽。还打不死。开篇说仙藤引领人类科技大进步，就不能升级一下手枪吗？科技进步的钱都花在哪了？,348
2019-08-09 04:26:29,谋杀游戏机,1,披着独立日科幻战争大片的外衣，内核还是纯爱片，还是鹿晗配舒淇...太可怕了。不是说两个类型不能融合，而是两种画风完全不搭，美术设定一通胡来，口型全都对不上，除了特效就是绿幕前摆摆动作+鹿晗画外音独白，给人一种真空塑料人打VR游戏的感觉。看完才知道《流浪地球》多么可贵，这《上海堡垒》又倒退回去了。只能说下了多少功夫、有多少真心都是能看出来的，观众不傻，跟风投机、流量撑票房的时代一去不复返了。鹿晗演技还算有点进步，相比之下舒淇可能更迷（也怪角色太花瓶），就是，鹿晗咱都是军人了染烫厚刘海可不可以剪剪？,61
2019-08-09 09:48:41,乖乖的戀風,1,向我开炮………燃不起来啊 大哥,378
2019-08-09 14:15:28,波吃曼,1,不好拍就不要拍啊，圈快钱真是惯养出的德性，放过科幻，把我的想象力还给我,377
2019-08-04 20:27:02,最上大劈程衝斗,2,一分给舒淇一分给未来局赠票，但是真的没办法给鼓励分。实际上我可能给的就是鼓励分。,46
2019-08-09 10:46:17,鹤溪,1,谁给宣发的脸让它碰瓷流浪地球？框框也稍微长点心吧，你就是这样对待自己写的书的？,340
2019-08-09 10:11:23,迷之尴尬,3,一星献给电影，一星献给舒淇，一星献给不怕赔的投资方，有了你们我才知道什么是人傻钱多，阿修罗和封神传奇还不够警醒吗，你们就当国产电影崛起的雷区警示牌吧，挺光荣的。,1020
2022-01-26 00:22:06,白昼流星,3,看了小说，挺期待这部电影的。从选角角度来说，舒淇和鹿晗都是非常好的人选。鹿晗饰演的江洋，那股小痞子的感觉,1
2019-08-09 16:32:22,谢谢你们的鱼,1,演员几乎全程口型都对不上，表演也是死气沉沉，不过遇上如此温吞水如白开水的剧本，没有任何人提得起精神，甚至大部分时间，他们都不知道自己在干啥。真的无法想象一部标榜自己是科幻大片的电影，场面又小又low就算了，讲述故事的方式居然比电视剧还要絮叨和缺乏想象力，从头到尾的腻人旁白，全程靠嘴的叙事，武戏和文戏的完全脱节，完全看不到导演的技法，节奏更是连网大都不如。影片的特效也是灾难级别，不免让人想起当年的《机器侠》。作为科幻片来说，科幻几乎就是背景，甚至连细节都懒得展现，大部分时间我都看不出来这是一部发生在未来的故事。整部电影的格局就配叫个啥《嘉定区堡垒》而已。,129
2019-08-09 21:25:42,德川咪咪,1,看到一半，旁边那个人拍拍我：能跟我解释下哪边是好人哪边是坏人吗？,111
2019-08-09 17:39:24,猫的房东,1,江南整天恰烂钱,102
2019-08-09 08:47:31,杀破狼,5,【————！！全篇剧透！！————】哎，看哭了5次：潘队牺牲时/路依依牺牲时/曾煜牺牲时/林澜牺牲时/最后江洋收到林澜回复的短信时。真的很好看！特效真的真的贼棒，场面极其震撼，母舰甫一出现攻击防炮御时，炸的我头皮发麻。后面还有一幕，捕食者在大家没注意时突然闯进指挥中心（好像是？），把我吓得从椅子上跳了起来，眼镜都飞了（因为我近视，眼镜上面还戴了3D眼镜）然后手忙脚乱扶眼镜。哭了好几次，找纸巾擦泪时有的片段可能错过了，后面一定要补回来。这电影真的看得超级爽！特效完全可以！,1678
2019-08-10 08:16:34,山雀,1,人心里的成见是一座大山，看了上海堡垒，鹿晗那座山又高了几千米,97
2019-08-09 23:53:52,风间隼,1,“科幻元年”之后当然是“科幻一年级”，你还指望中国电影一下进化到2019年不成？,59
2019-08-04 21:56:14,养一只肥肥的鹅,3,全片最大的亮点可能就是特效还好一些吧，不过如果放在现在国产电影的特效程度上来讲也算是中高等，中国科幻电影不算很多，敢做就是突破。世界观没有流浪地球大，也没什么可比性，特效也不是一个级别的。感情交代还算清楚，几乎全部选择自杀的战友情，两对朦胧的爱情，为人类生存舍弃生命的大义，该有的都有了，不过有些的确算是比较老套。这部电影不功不过，喜欢战争科幻可以一看，打斗场面还可以。当然，鹿晗主角光环是有的，眼神戏虽有点稚嫩但也不错，舒淇也是真的女神！很疑惑的就是：为什么有很多台词口型对不上？,473
2019-08-09 00:49:06,二笙长居我家长,1,能不能别扯科幻，中国科幻都被你们搞成这样了。偶像就去玩综艺好吗？表情真是烂到家了，真是什么样的导演什么样的演员，一锅老鼠屎。,383
2019-08-31 13:14:24,黄青蕉,1,真是一部神奇的电影：一方面剧情无聊到让人想开十倍速快进全程，另一方面槽点又多到想在b站按帧看弹幕吐槽反复观赏20遍,33
2019-08-11 13:07:29,醉卧羙人膝,5,上海堡垒这个片子，真的挺好，演员演技十分出色一看就知道他在演。虽然是配音，但是有特别多的地方都对的上，最需要夸赞的就是特效，相当震撼，一看就知道是特效。强烈推荐大家去看一看，毕竟冤枉钱不能我一个人花。,114
2019-08-09 16:15:34,JSYYY,1,我怀疑他抄袭奥特曼，但我没有证据,109
2019-08-09 13:23:56,Wall.E,1,不为别的，就冲鹿娘娘这发型也就值0分了。演个军人连头发都舍不得剪？哪个国家的男军人可以留长发，还烫头？,145
2019-08-14 01:22:08,天青色在等烟雨,1,铁血硬汉鹿晗为演军人忍痛剪掉三根头发,69
2019-12-20 00:27:28,胤祥,1,看完了这个片我默默地又把书找了出来读了一遍……嗯改成这么一个哪儿都不挨着哪儿的片也是挺让人服气的。Netflix都下手买了，说明片子还是有一定水准的。祝热心市民江先生事业有成，财源广进。,28
